Description;Finisher front stapler problem • The front stapler home position sensor does not change state from nondetection to detection within 200 ms of the start of front stapler motor counterclockwise (forward) rotation. • During initialization, the front stapler home position sensor does not change state from non-detection to detection within 600 ms of the start of front stapler motor clockwise (reverse) rotation.
Causes;The front stapler connector makes poor contact. The front stapler malfunctions. a) The front stapler is blocked with a staple. b) The front stapler is broken. Defective finisher main board.
Remedy;Reinsert the connector. Also check for continuity within the connector cable. If none, remedy or replace the cable. a) Remove the front stapler cartridge, and check the cartridge and the stapling section of the stapler. b) Replace the front stapler and check for correct operation. Replace the finisher main board and check for correct operation.
Code;8220
Description;Finisher rear stapler problem • The rear stapler home position sensor does not change state from non-detection to detection within 200 ms of the start of rear stapler motor counterclockwise (forward) rotation. • During initialization, the rear stapler home position sensor does not change state from non-detection to detection within 600 ms of the start of rear stapler motor clockwise (reverse) rotation.
Causes;The rear stapler connector makes poor contact. The rear stapler malfunctions. a) The rear stapler is blocked with a staple. b) The rear stapler is broken. Defective finisher main PCB.
Remedy;Reinsert the connector. Also check for continuity within the connector cable. If none, remedy or replace the cable. a) Remove the front stapler cartridge, and check the cartridge and the stapling section of the stapler. b) Replace the front stapler and check for correct operation. Replace the finisher main PCB and check for correct operation.
Code;8300
Description;Booklet stitcher paper ejection motor problem
Causes;A problem is detected with the paper ejection motor.
Remedy;See the booklet stitcher service manual.
Code;8310
Description;Booklet stitcher elevation motor problem
Causes;A problem is detected with the elevation motor.
Remedy;See the booklet stitcher service manual.
Code;8320
Description;Booklet stitcher rear jog motor problem
Causes;A problem is detected with the rear jog motor.
Remedy;See the booklet stitcher service manual.
Code;8330
Description;Booklet stitcher front jog motor problem
Causes;A problem is detected with the front jog motor.
Remedy;See the booklet stitcher service manual.
Code;8340
Description;Booklet stitcher staple motor problem
Causes;A problem is detected with the staple motor.
Remedy;See the booklet stitcher service manual.
Code;8350
Description;Booklet stitcher batch processing motor problem
Causes;A problem is detected with the batch processing motor.
Remedy;See the booklet stitcher service manual.
Code;8360
Description;Booklet stitcher stapler shift motor problem
Causes;A problem is detected with the stapler shift motor.
Remedy;See the booklet stitcher service manual.
Code;8370
Description;Booklet stitcher paddle motor problem
Causes;A problem is detected with the paddle motor.
Remedy;See the booklet stitcher service manual.
Code;8380
Description;Booklet stitcher folding problem
Causes;A problem is detected with the folding sensor.
Remedy;See the booklet stitcher service manual.
Code;8390
Description;Booklet stitcher backup RAM data problem
Causes;A backup RAM data error is detected.
Remedy;See the booklet stitcher service manual.
Code;8400
Description;Booklet stitcher incorrect type problem
Causes;An incorrect type error is detected.
Remedy;See the booklet stitcher service manual.
Code;8410
Description;Booklet stitcher punch motor problem
Causes;A problem is detected with the punch motor.
Remedy;See the booklet stitcher service manual.
Code;8420
Description;Booklet stitcher shift motor problem
Causes;A problem is detected with the shift motor.
Remedy;See the booklet stitcher service manual.
Code;8430
Description;Booklet stitcher punch communication problem
Causes;A problem is detected with the punch communication.
Remedy;See the booklet stitcher service manual.
Code;8440
Description;Booklet stitcher punch sensor problem
Causes;A problem is detected with the punch sensor.
Remedy;See the booklet stitcher service manual.
Code;8450
Description;Booklet stitcher side punch sensor problem
Causes;A problem is detected with the side punch sensor.
Remedy;See the booklet stitcher service manual.
Code;8460
Description;Booklet stitcher punch backup RAM data problem
Causes;A problem is detected with the punch backup RAM data.
Remedy;See the booklet stitcher service manual.
Code;8470
Description;Booklet stitcher punch dust sensor problem
Causes;A problem is detected with the punch dust sensor
Remedy;See the booklet stitcher service manual.
Code;8480
Description;Booklet stitcher broken punch power source wire problem
Causes;A broken punch power source wire problem is detected.
Remedy;See the booklet stitcher service manual.
Code;F0
Description;Main controller PWB error • The operation breakdown occurs between main controller PWB and operation panel PWB during 30 seconds.
Causes;Defective main controller PWB. Defective operator panel PWB. Defective mainengine controllers relay PWB. Defective engine controller PWB . Defective harness between engine controller PWB and operator panel PWB, or poor contact of the connector terminals.
Remedy;Replace the main controller PWB. Replace the operator panel PWB. Replace the main-engine controllers relay PWB. Replace the engine controller PWB. Check the continuity of the harness. Check the insertion of connectors.
Code;F010
Description;System DIMM checksum error • Checksum for the system DIMM PWB that holds the system program is wrong.
Causes;Defective system DIMM PWB. Defective main controller PWB.
Remedy;Replace the system DIMM PWB. Replace the main controller PWB.
Code;F020
Description;Memory check error • Access to the expanding memory (DIMM) or RAM on the main controller PWB is unobtainable.
Causes;Defective main controller PWB. Defective expansion memory (DIMM).n t
Remedy;Replace the main controller PWB. Replace the expansion memory (DIMM).
Code;F030
Description;Main controller PWB system error • The error concerned with the system occurred except self diagnostic codes F0 (F010) conditions.
Causes;Defective main controller PWB.
Remedy;Replace the main controller PWB.
Code;F040
Description;Main - Engine controller PWBs communication error • The communication breakdown occurred between main controller PWB and engine controller PWB during 30 seconds.
Causes;Defective engine controller PWB. Defective main controller PWB.
Remedy;Replace the engine controller PWB.
Code;F080
Description;Flash ROM checksum error • Check result is not correct about flash ROM checksum of engine controller PWB.
Causes;Defective engine controller PWB.
Remedy;Replace the main controller PWB.
