Code;A1-1210
Display;Actuator Motor Failure : #A1-1210. Call for service if the problem persists.
Description;The fuser motor does not operate. / The fuser motor is operating but is recognized as stop status.
Remedy;1) Turn the machine off then on. If the error persists, turn the machine off again. 2) Remove the rear and right cover. 3) Check if there are any obstacles or paper around the fuser unit. 4) Check if the connection between main board and fuser motor are correct. 5) If the connection is OK, replace the fuser motor. 6) If the problem persists, replace the main board.
Code;A1-2114, A1-3621, A1-3622
Display;Actuator Motor Failure : #. Call for service if the problem persists.
Description;The motor for OPC/Deve/ITB does not operate.
Remedy;1) Turn the machine off then on. If the error persists, turn the machine off again. 2) Remove the right cover. 3) Check if the connection between main board and motor in the main drive unit are correct. 4) If the connection is OK, replace the motor. 5) If the problem persists, replace the main drive unit.
Code;A1-4111, A1-4112, A1-4310
Display;Actuator Motor Failure : #. Call for service if the problem persists.
Description;The motor for OPC/Deve/ITB does not operate.
Remedy;1) Turn the machine off then on. If the error persists, turn the machine off again. 2) Remove the right cover. 3) Check if the connection between main board and motor in the main drive unit are correct. 4) If the connection is OK, replace the motor. 5) If the problem persists, replace the main drive unit.
Code;A2-1210, A2-2110
Display;Actuator Fan Failure : #. Call for service if the problem persists.
Description;The SMPS fan or Fuser fan does no operate normally.
Remedy;1) Turn the machine off then on. If the error persists, turn the machine off again. 2) Remove the right cover. 3) Check if the connection between main board and the related fan is correct. 4) If the connection is OK, replace the defective fan.
Code;A3-3211, A3-3212
Display;Actuator Sensor Failure #: Call for service if the problem persists.
Description;The inner temperature sensor is defective.
Remedy;1) Turn the machine off then on. If the error persists, turn the machine off again. 2) Enter the tech mode. Check the temperature sensor output. 3) If the sensor is defective, replace it. 4) If the temperature sensor is OK, replace the main board.
Code;A3-3311, A3-3312
Display;Actuator Sensor Failure #: Call for service if the problem persists.
Description;The outer temperature sensor is defective.
Remedy;1) Turn the machine off then on. If the error persists, turn the machine off again. 2) Enter the tech mode. Check the temperature sensor output. 3) If the sensor is defective, replace it. 4) If the temperature sensor is OK, replace the main board.
Code;A3-3320
Display;Not proper room temperature. Change room temperature.
Description;The value of the outer temperature sensor is out of normal area.
Remedy;1) Check if the machine is installed in the proper area. 2) If the temperature sensor is defective, replace it.
Code;C2-2110, C2-3110
Display;Prepare new (color) toner cartridge.all f
Description;The remaining toner cartridge is less than 10%
Remedy;1) Print the supply information report. Check the life remaining of the toner cartridge. 2) If its life is at the end, turn the machine off and replace the toner cartridge with new one.
Code;C2-2120, C2-2150, C2-3120
Display;Replace with new (color) toner cartridge.
Description;The toner cartridge is at the end of its life.
Remedy;1) Print the supply information report. Check the life remaining of the toner cartridge. 2) If its life is at the end, turn the machine off and replace the toner cartridge with new one.
Code;C2-2320, C2-2410, C2-3320
Display;(color) Toner Failure: #. Install (color) toner cartridge again. Install yellow toner cartridge.
Description;The toner cartridge is not installed or the CRUM has some problem.
Remedy;1) Check if the toner cartridge is installed properly. Turn the machine off then on. 2) If the error message is not disappear, remove the toner cartridge. Thoroughly roll the cartridge five or six times to distribute the toner evenly inside the cartridge. And reinstall the toner cartridge. 3) If the problem persists, check that the CRUM contact area is contaminated. Clean it. 4) If the problem persists, replace the toner cartridge with new one.
Code;C2-2512, C2-3512
Display;(Color) toner cartridge is not compatible. Check user`s guide.
Description;Toner cartridge is not compatible.
Remedy;1) Print the supply information report. Check information of the toner cartridge. 2) If the toner cartridge is not a Samsung genuine toner cartridge, replace with new one.
Code;C2-3150, C2-4120, C2-4150
Display;Replace with new (color) toner cartridge.
Description;The toner cartridge is at the end of its life.
Remedy;1) Print the supply information report. Check the life remaining of the toner cartridge. 2) If its life is at the end, turn the machine off and replace the toner cartridge with new one.
Code;C2-3410, C2-4320, C2-4410
Display;(color) Toner Failure: #. Install (color) toner cartridge again. Install yellow toner cartridge.
Description;The toner cartridge is not installed or the CRUM has some problem.
Remedy;1) Check if the toner cartridge is installed properly. Turn the machine off then on. 2) If the error message is not disappear, remove the toner cartridge. Thoroughly roll the cartridge five or six times to distribute the toner evenly inside the cartridge. And reinstall the toner cartridge. 3) If the problem persists, check that the CRUM contact area is contaminated. Clean it. 4) If the problem persists, replace the toner cartridge with new one.
Code;C2-4110, C2-5110
Display;Prepare new (color) toner cartridge.all f
Description;The remaining toner cartridge is less than 10%
Remedy;1) Print the supply information report. Check the life remaining of the toner cartridge. 2) If its life is at the end, turn the machine off and replace the toner cartridge with new one.
Code;C2-4512, C2-5512
Display;(Color) toner cartridge is not compatible. Check user`s guide.
Description;Toner cartridge is not compatible.
Remedy;1) Print the supply information report. Check information of the toner cartridge. 2) If the toner cartridge is not a Samsung genuine toner cartridge, replace with new one.
Code;C2-5120, C2-5150
Display;Replace with new (color) toner cartridge.
Description;The toner cartridge is at the end of its life.
Remedy;1) Print the supply information report. Check the life remaining of the toner cartridge. 2) If its life is at the end, turn the machine off and replace the toner cartridge with new one.
Code;C2-5320, C2-5410
Display;(color) Toner Failure: #. Install (color) toner cartridge again. Install yellow toner cartridge.
Description;The toner cartridge is not installed or the CRUM has some problem.
Remedy;1) Check if the toner cartridge is installed properly. Turn the machine off then on. 2) If the error message is not disappear, remove the toner cartridge. Thoroughly roll the cartridge five or six times to distribute the toner evenly inside the cartridge. And reinstall the toner cartridge. 3) If the problem persists, check that the CRUM contact area is contaminated. Clean it. 4) If the problem persists, replace the toner cartridge with new one.
Code;C5-1110, C5-1120
Display;Prepare new transfer belt unit. Replace new transfer belt unit.
Description;The ITB Unit is at the end of its life.
Remedy;1) Print the supply information report. Check the life remaining of the ITB unit. 2) If its life is at the end, turn the machine off and replace the ITB unit with new one.
Code;C5-1310
Display;Install image transfer belt unit.
Description;The ITB Unit is not installed properly.
Remedy;1) Turn the machine off. Remove and reinstall the ITB unit. 2) Turn the machine on. If the problem persists, replace the ITB unit.
Code;C5-1410
Display;Image transfer belt unit is not compatible. Check users guide.
Description;The ITB unit is not compatible.
Remedy;1) Print the supply information report. Check information of the ITB Unit. 2) If the toner cartridge is not a Samsung genuine ITB Unit, replace with new one. 4-
Code;C5-1710
Display;Sensor Failure: #C5-1710. Turn off then on.
Description;The ITB home position sensor has the problem.
Remedy;1) Turn the machine off. Replace the ITB Unit.
Code;C6-1110, C6-1120
Display;Prepare new fuser unit. Replace with new fuser unit.
Description;The fuser unit is at the end of its life.
Remedy;1) Print the supply information report. Check the life remaining of the fuser unit. 2) If its life is at the end, turn the machine off and replace the fuser unit with new one.
Code;C7-1110
Display;Waste toner container is almost full. Order new one.
Description;The waste toner container is at the end of its life.
Remedy;1) Print the supply information report. Check the life remaining of the waste toner container. 2) If its life is at the end, turn the machine off and replace the waste toner container with new one.
Code;C7-1311
Display;Waste toner container is not installed. Install it.
Description;The waste toner container is not installed
Remedy;1) Check if the waste toner container is installed properly. 2) Remove and reinstall the waste toner container.
Code;C9-1112, C9-1116
Display;Replace with new Tray1 pickup roller. End of life, Replace with new Tray1 retard roller.
Description;The pick up roller or reverse roller is at the end of its life.
Remedy;1) Turn the machine off. 2) Replace the pick up roller Assy and reverse roller Assy.
Code;C9-1122, C9-1126
Display;Replace with new Tray2 pickup roller. End of life, Replace with new Tray2 retard roller.
Description;The pick up roller or reverse roller is at the end of its life.
Remedy;1) Turn the machine off. 2) Replace the pick up roller Assy and reverse roller Assy from the tray2
Code;C9-1162
Display;Replace with new MP pickup roller.
Description;The MP pick up roller is at the end of its life.
Remedy;Troubleshooting method 1) Turn the machine off. 2) Replace the MP pick up roller.
Code;H1-1210
Display;Paper jam in Tray 2
Description;The jammed paper has occurred in the tray2.
Remedy;1) Remove the jammed paper. 2) If the jammed paper occurs continually, check the followings. a) Check if the pick up/forward/reverse roller are worn out or contaminated. Clean the contaminated part or replace it. b) Check if the actuator is assembled correctly. 3) If the pick up clutch is defective, replace it.
Code;H1-1252
Display;Paper is empty in Tray 2. Load paper.
Description;Paper is empty in Tray1
Remedy;1) Take off the cassette. If there is no paper on the tray2, load the paper. 2) If the problem persists, check the following. a) Check if the paper empty sensor is contaminated or defective. Replace it.
Code;M1-1110
Display;Paper Jam in Tray 1
Description;The jammed paper has occurred in the tray1.
Remedy;1) Remove the jammed paper. 2) If the jammed paper occurs continually, check the followings. a) Check if the pick up/forward/reverse roller are worn out or contaminated. Clean the contaminated part or replace it. b) Check if the actuator is assembled correctly. 3) Check the motor operation, gear in the PH drive unit. If there is any defective parts, replace it or PH drive unit.
Code;M1-1610
Display;Paper Jamin MP tray
Description;The jammed paper has occurred in the MP tray.
Remedy;1) Remove the jammed paper. 2) If the jammed paper occurs continually, check the followings. a) Check if the pick up/forward/reverse roller are worn out or contaminated. Clean the contaminated part or replace it. b) Check if the actuator is assembled correctly. 3) If the pick up clutch is defective, replace it. 4) If the problem persists, replace the MP unit.
Code;M1-5112, M1-5612
Display;Paper Empty in Tray1 Paper Empty in MP Tray
Description;Paper is empty in Tray1
Remedy;1) Take off the cassette. If there is no paper on the tray, load the paper. 2) If the problem persists, check the following. a) Check if the paper empty sensor is contaminated or defective. Replace it.
Code;M2-1110, M2-2210
Display;Paper Jam inside machine Paper Jam inside of duplex
Description;The jammed paper has occurred inside machine.
Remedy;1) Open the rear cover. Remove the jammed paper. 2) If the problem persists, check the following. a) Check if there is any obstacles or paper on the paper path. Remove it. b) Check if the FRAME-REGI unit and FRAME-RATARD unit are assembled properly. If there is any defective part in these units, replace it or Assy. c) Check the motor operation, gear in the PH drive unit. If there is any defective parts, replace it or PH drive unit. d) Check the T1-DRIVE unit. If there is any defective parts, replace it or T1-DRIVE unit.
Code;M3-1110
Display;Paper Jam in exit area
Description;The jammed paper has occurred in the exit area.
Remedy;1) Remove the jammed paper. 2) If the problem persists, check the following. a) Check if there is any obstacles or paper on the paper path. Remove it. b) Check if the fuser unit is assembled properly. If the fuser unit is defective, replace it. c) Check if the exit unit has any defective parts. Replace the exit unit.
Code;M3-2130
Display;Output bin full Remove paper
Description;The machine detected that the output tray has got full or the bin-full sensor is defective.
Remedy;1) Remove the paper on the output tray. 2) Check if the Bin-full Sensor connector is connected properly. Reconnect it. 3) If the sensor is defective, replace it.
Code;S2-1210
Display;Error #S2-1210 Call for service
Description;The power Micom chip on main board is not detected.
Remedy;1) Turn the machine off then on. 2) If the error persists, replace the main board.
Code;S2-4120
Display;Door open Close it
Description;Door is open or the cover open switch is defective.
Remedy;1) Check if the front cover is closed perfectly. 2) If the error persists, check that the cover-open sensor is working normally. If it is defective, replace the HVPS board.
Code;S5-3110
Display;Error #S5-3110 Call for service
Description;The communication error between main board and OPE board has occurred.
Remedy;1) Turn the machine off then on. 2) If the problem persists, check the followings. a) Check the connection between main board and OPE board. Reconnect the harness. b) If the connection is OK, replace the main board or OPE board.
Code;S6-3123, S6-3128
Display;Network Problem: IP Conflict 802.1x Network Error
Description;IP address conflicts with that of other system.
Remedy;1) Change the machine’s IP address. 2) Check the setting-up for 802.1x confirmation server.
Code;U1-2115, U1-2116
Display;Error # Turn off then on
Description;The fuser unit has the problem for pressure control.
Remedy;1) Turn the machine off. Remove and reinstall the fuser unit. Turn the machine off. Is this error message disappeared? 2) Open the rear cover. Check if the fuser pressure cam is working normally. • If the cam operation is normal, replace the cam sensor. 3) Remove the side cover. Check if the fuser motor is working normally. 4) Check if the swing-gear is in the position below when the cam works. If not, replace the fuser drive unit.
Code;U1-2132, U1-2315, U1-2320
Display;Error # Turn off then on
Description;The temperature control of fuser unit is abnormal.
Remedy;1) Check if the input voltage is normal. 2) Turn the machine off. Remove and reinstall the fuser unit. Be careful when connecting the AC-connector and Thermistor connector. 3) Turn the machine on. Is the error message is disappeared? 4) Check the followings. If the fuser unit has any problem, replace it. a) Check if the fuser connector is connected properly. b) Check if the halogen lamp voltage is normal. c) Check if the thermistor is contaminated or twisted. 5) If the problem persists, replace the main board or SMPS board.
Code;U1-2330, U1-2334
Display;Error # Turn off then on
Description;The temperature control of fuser unit is abnormal.
Remedy;1) Check if the input voltage is normal. 2) Turn the machine off. Remove and reinstall the fuser unit. Be careful when connecting the AC-connector and Thermistor connector. 3) Turn the machine on. Is the error message is disappeared? 4) Check the followings. If the fuser unit has any problem, replace it. a) Check if the fuser connector is connected properly. b) Check if the halogen lamp voltage is normal. c) Check if the thermistor is contaminated or twisted. 5) If the problem persists, replace the main board or SMPS board.
Code;U1-2340, U1-234H
Display;Error # Turn off then on
Description;The temperature control of fuser unit is abnormal.
Remedy;1) Check if the input voltage is normal. 2) Turn the machine off. Remove and reinstall the fuser unit. Be careful when connecting the AC-connector and Thermistor connector. 3) Turn the machine on. Is the error message is disappeared? 4) Check the followings. If the fuser unit has any problem, replace it. a) Check if the fuser connector is connected properly. b) Check if the halogen lamp voltage is normal. c) Check if the thermistor is contaminated or twisted. 5) If the problem persists, replace the main board or SMPS board.
Code;U2-6122, U2-6142, U2-6143
Display;Error # Turn off then on
Description;LSU Motor does not work normally. / LSU Hsync signal is abnormal.
Remedy;1) Check if the LSU harness on the main board is connected properly. 2) If it is OK, check that the LSU harness on LSU board is connected properly. 3) Check if the LSU harness is defective. 4) If the problem persists, replace the LSU. 5) If the problem persists after replacing LSU, replace the main board.
Code;U3-3213, U3-3214
Display;Original paper jam in front of scanner. Original paper jam inside of scanner.
Description;A document jam was detected in the ADF unit.
Remedy;1) Remove the jammed paper from ADF unit. 2) If the error persists, turn the machine off then on. 3) If the document jam occurs continually, open the ADF cover-top. Check if the ADF pick up roller is contaminated or worn out. Clean or replace it. 4) If the pick up roller is OK, check the followings. a) Check if the ADF motor is working normally. b) Check if the connector on the ADF joint board is connected correctly. 5) If the problem persists, replace the ADF unit.
Code;U3-3313, U3-3314
Display;Original paper jam in front of scanner. Original paper jam inside of scanner.
Description;A document jam was detected in the ADF unit.
Remedy;1) Remove the jammed paper from ADF unit. 2) If the error persists, turn the machine off then on. 3) If the document jam occurs continually, open the ADF cover-top. Check if the ADF pick up roller is contaminated or worn out. Clean or replace it. 4) If the pick up roller is OK, check the followings. a) Check if the ADF motor is working normally. b) Check if the connector on the ADF joint board is connected correctly. 5) If the problem persists, replace the ADF unit.
Code;U3-4110
Display;Door of scanner is open.
Description;ADF top cover is opened.
Remedy;1) Close the ADF top cover.
