Code;A0-01
Description;PCU PWB ROM error
Causes;The firmware version-up is not completed properly by interruption of the power during the version-up operation, etc. ROM trouble.
Remedy;Use SIM49-1 to perform the version-up procedure again. ROM trouble.
Code;A0-02
Description;SCU PWB ROM error
Causes;The firmware version-up is not completed properly by interruption of the power during the version-up operation, etc. ROM trouble.
Remedy;Use SIM49-1 to perform the version-up procedure again. ROM trouble.
Code;A0-10
Description;MFP PWB ROM error
Causes;Firmware combination error between the MFP and the image ROM (color correction ROM).
Remedy;Upgrade the firmware versions of the MFP and the image ROM (color correction ROM).
Code;A0-11
Description;Firmware version inconsistency (MFP - PCU)
Causes;Firmware combination error between the MFP and the PCU.
Remedy;Check the combination between the MFP and the PCU.
Code;A0-12
Description;Firmware version inconsistency (MFP - SCU)
Causes;Firmware combination error between the MFP and the SCU.
Remedy;Check the combination between the MFP and the SCU.
Code;A0-20
Description;MFP firmware version and EEPROM data version inconsistency
Causes;MFP Cause Inconsistency between the MFP firmware version and the EEPROM data version.
Remedy;Check the combination of the firmware.
Code;A0-21
Description;PCU firmware version and EEPROM data version inconsistency
Causes;Inconsistency between the PCU firmware version and the EEPROM data version.
Remedy;Check the combination of the firmware.
Code;A0-22
Description;SCU firmware version and EEPROM data version inconsistency
Causes;Inconsistency between the SCU firmware version and the EEPROM data version.
Remedy;Check the combination of the firmware.
Code;C1-10
Description;Main charger trouble
Causes;The main charger unit is not installed properly. There is an abnormality in the main charger unit. Disconnection of the high voltage PWB connector. Breakage of the high voltage harness. MC/DV PWB trouble. PCU PWB trouble
Remedy;Check the output of the main charger with SIM8-2. Check disconnection of the main charger./Replace. Check disconnection of the high voltage PWB. connector. /Replace. Replace the MC/DV PWB. Replace the PCU PWB.
Code;C4-00
Description;PTC trouble
Causes;The PTC unit is not properly installed. PTC unit trouble. TC PWB trouble. PCU PWB trouble. Connector, harness connection trouble.
Remedy;Clean the PTC with the PTC cleaner. Replace the PTC unit. Replace the secondary transfer PWB. Replace the PCU PWB. Check connection of the connector and the harness.
Code;E7-01
Description;MFP image data error
Causes;Image data transfer error in the MFP PWB. MFP PWB trouble.
Remedy;Check connection of the connector and the harness of the MFP PWB. Replace the MFP PWB.
Code;E7-03
Description;HDD trouble
Causes;Connector, harness connection trouble in the MFP PWB and HDD. HDD (error file management area) data abnormality (FAT breakage). MFP PWB trouble.
Remedy;Check connection of the connector and the harness of the MFP PWB and HDD. Use SIM62-2, 3 to check read/write operations of the HDD. Replace the HDD. Replace the MFP PWB.
Code;E7-04
Description;HDD-ASIC error
Causes;HDD-ASIC trouble. An error occurs in the HDD-ASIC self test when booting.
Remedy;Replace the MFP PWB.
Code;E7-05
Description;Standard memory/expansion memory read/write error (MFP PWB)
Causes;Improper insertion of the memory. Garbled memory data. The memory capacity is not the specified level.
Remedy;Check insertion of the memory. Use SIM60-1 to check the read/write operations of the memory. Replace the expansion memory. Replace the MFP PWB.
Code;E7-06
Description;Image data decode error
Causes;Compressed image data abnormality. HDD connection trouble when HDD is installed. Image data compression/transfer data garble. MFP PWB trouble.
Remedy;If the job at an occurrence of an error is a FAX job, check the FAX PWB. Check connection of the MFPC PWB and the HDD. Replace the MFPC PWB.
Code;E7-08
Description;MFP memory compatibility error (MFP PWB)
Causes;A DIMM of different specifications is installed to the MFP memory slot. DIMM trouble.
Remedy;Check the installed DIMM. Replace the DIMM.
Code;E7-09
Description;Standard memory size/Expansion memory size error (MFP PWB)
Causes;A DIMM other than below is installed to the default throttle. • 40-sheet machine System memory: 1GB Local memory: 512MB • 31-sheet machine System memory: 512MB Local memory: 512MB DIMM trouble. Insufficient memory size.
Remedy;Replace the DIMM.
Code;E7-10
Description;Shading error (Black correction)
Causes;Abnormality in the CCD black scan level when the scanner lamp is turned OFF. Improper installation of the harness to the carriage unit/SCU PWB. Carriage unit abnormality. SCU PWB abnormality.
Remedy;Check connection of the harness to the carriage unit/SCU PWB. Check the carriage unit. Check the SCU PWB.
Code;E7-11
Description;Shading error (White correction)
Causes;Abnormality in the CCD white reference plate scan level when the scanner lamp is turned ON. Improper installation of the harness to the carriage unit/SCU PWB. Dirt on the mirror, lens, and the reference white plate. Scanner lamp lighting trouble. Carriage unit abnormality. SCU PWB abnormality.
Remedy;Check connection of the harness to the carriage unit/SCU PWB. Check connection of the harness to the scanner lamp unit. Clean the mirror, the lens, and the reference white plate. Check the carriage unit. Check the SCU PWB.
Code;E7-14
Description;CCD-ASIC error
Causes;SCU PWB trouble.
Remedy;Check the SCU PWB. Replace the SCU PWB.
Code;E7-20
Description;LSU laser detection error
Causes;Optical axis shift. Reduced laser power, lighting error, laser diode trouble. BD PWB trouble. Harness and connector trouble between the LD/BD PWB and the LSU cnt PWB.
Remedy;Use SIM61-1 to check the operation of the LSU. Check the PWB and connection of the harness in the LSU. Replace the LSU.
Code;E7-21
Description;LSU LD deterioration trouble
Causes;Laser deterioration, power reduction Harness and connector trouble between the LD PWB and the LSU control PWB.
Remedy;Use SIM61-1 to check the operation of the LSU. Check the PWB and connection of the harness in the LSU. Replace the LSU control PWB.
Code;E7-28
Description;LSU-PCU connection error
Causes;Communication error between the CPU in the PCU PWB and the control ASIC. Improper connection of the communication connector between the PCU PWB and the LSU cnt PWB (interface PWB). Harness trouble between the PCU PWB and the LSU cnt PWB (interface PWB) PCU PWB or LSU cnt PWB (interface PWB) trouble
Remedy;Check connection of the connector and the harness between the PCU PWB and the LSU cnt PWB (interface PWB). Replace the LSU cnt PWB. Replace the PCU PWB.
Code;E7-29
Description;LSU ASIC frequency error
Causes;Oscillation abnormality of the external oscillator and the internal oscillating circuit used in the LSU ASIC. LSU ASIC abnormality on the LSU ASIC PWB.
Remedy;Replace the LSU cnt PWB.
Code;E7-50
Description;Engine connection trouble
Causes;A PWB, or firmware, or LSU which is not supported by the machine specifications is detected in the PCU PWB. PCU PWB trouble. LSU trouble.
Remedy;Check the kind and the version of the firmware. Check the LSU, and replace it if necessary. Check the PCU PWB, and replace it if necessary.
Code;E7-55
Description;PWB information sum error (Engine detection)
Causes;PCU EEPROM sum check error. PCU EEPROM trouble. PCU EEPROM contact trouble. Malfunction due to noises
Remedy;Replace the PCU PWB. Replace the PCU EEPROM.
Code;E7-60
Description;Combination error between the MFP PWB and other PWB, firmware
Causes;A PWB or firmware which is not supported by the machine specifications is detected in the MFP PWB. MFP PWB trouble. The PWB/firmware which is not supported by the machine specifications is connected.
Remedy;Check the kind and the version of the firmware. Check the MFP PWB, and replace it if necessary.
Code;E7-61
Description;Combination error between the MFP PWB and the PCU PWB
Causes;Combination error between the MFP PWB and the PCU PWB. MFP PWB trouble. PCU PWB trouble.
Remedy;Check the combination between the MFP PWB and the PCU PWB. Replace the MFP PWB. Replace the PCU PWB.
Code;E7-65
Description;MFP EEPROM sum check error
Causes;MFP PWB EEPROM device breakdown. Contact trouble of the MFP EEPROM device. Malfunction due to noises.
Remedy;Replace the MFP PWB. Replace the MFP PWB EEPROM.
Code;E7-80
Description;MFP-SCU PWB communication error
Causes;SCU PWB connector connection trouble. SCU PWB - MFP PWB connection trouble. SCU PWB mother board connection trouble. SCU PWB trouble. MFP PWB trouble. Replace the mother board.
Remedy;Check connection of the SCU PWB, the MFP PWB, and the mother board. Check the earth line. Replace the SCU PWB. Replace the MFP PWB. Replace the mother board.
Code;E7-90
Description;MFP-PCU PWB communication error
Causes;PCU PWB connector connection trouble. PCU PWB - MFP PWB connection trouble. PCU PWB motherboard connection trouble. PCU PWB trouble. MFP PWB trouble. Replace the mother board.
Remedy;Check connection of the PCU PWB, the MFP PWB, and the mother board. Check the earth line. Replace the PCU PWB. Replace the MFP PWB. Replace the mother board.
Code;EE-EC
Description;Automatic toner density adjustment error
Causes;Toner density sensor trouble. Developing unit trouble. PCU PWB trouble.
Remedy;Replace the toner density sensor. Replace the developing unit. Replace the PCU PWB.
Code;EE-EL
Description;Automatic toner density adjustment error (Over toner)
Causes;Toner density sensor trouble. Charging voltage/ developing voltage trouble, toner density trouble, or developing unit trouble. PCU PWB trouble.
Remedy;Replace the toner density sensor. Replace the developing unit. Replace the PCU PWB.
Code;EE-EU
Description;Automatic toner density adjustment error (Under toner)
Causes;Toner density sensor trouble. Charging voltage/ developing voltage trouble, toner density trouble, or developing unit trouble. PCU PWB trouble.
Remedy;Replace the toner density sensor. Replace the developing unit. Replace the PCU PWB.
Code;F1-00
Description;Finisher - PCU PWB communication error
Causes;Connection trouble of the connector and the harness between the finisher and the PCU PWB. Finisher control PWB trouble. PCU PWB trouble. Strong external noises.
Remedy;Check the connector and the harness between the finisher and the PCU PWB. Replace the finisher control PWB. Replace the PCU PWB.
Code;F1-03
Description;Finisher paper exit roller lifting operation trouble
Causes;Finisher paper exit roller lift motor trouble. Harness and connector connection trouble. Home position sensor trouble. Finisher control PWB trouble.
Remedy;Use SIM3-3 to check the operation of the paper exit roller lift motor. Replace the paper exit roller lift motor. Check connection of the connector and the harness. Replace the home position sensor. Replace the finisher control PWB.
Code;F1-10
Description;Staple operation trouble
Causes;Staple motor trouble. Finisher control PWB trouble. Home position sensor trouble.
Remedy;Use SIM3-3 to check the operation of the staple motor. Replace the staple motor. Check connection of the connector and the harness. Replace the home position sensor. Replace the finisher control PWB.
Code;F1-15
Description;Finisher paper exit tray lift operation trouble
Causes;Paper exit tray lift motor trouble. Finisher control PWB trouble.
Remedy;Use SIM3-3 to check the operation of the paper exit tray lift motor. Replace the finisher control PWB. Replace the paper exit tray lift motor.
Code;F1-19
Description;Finisher alignment operation trouble F
Causes;Finisher paper alignment motor lock. Motor speed abnormality. Over-current to the motor. Finisher control PWB trouble.
Remedy;Use SIM3-3 to check the operation of the paper alignment motor F. Replace the finisher control PWB. Replace the paper alignment motor F.
Code;F1-20
Description;Finisher alignment operation trouble R
Causes;Finisher paper alignment motor lock. Motor speed abnormality. Over-current to the motor. Finisher control PWB trouble.
Remedy;Use SIM3-3 to check the operation of the paper alignment motor R. Replace the finisher control PWB. Replace the paper alignment motor R.
Code;F1-21
Description;Finisher fan trouble
Causes;Finisher fan motor trouble. Finisher control PWB trouble. Harness and connector connection trouble.
Remedy;Use SIM3-3 to check the operation of the fan motor. Check connection between the finisher control PWB and the fan. Replace the fan. Replace the finisher control PWB.
Code;F1-29
Description;Finisher PWB fan trouble
Causes;Finisher PWB fan lock. Finisher control PWB trouble. Connection trouble of the connector and the harness.
Remedy;Use SIM 3-3 to check the operation of the control PWB cooling fan (FBCF). Replace the finisher PWB fan. Replace the finisher control PWB. Connection trouble of the connector and the harness.
Code;F1-37
Description;Finisher data backup RAM error
Causes;Finisher control PWB trouble. Malfunction due to noises
Remedy;Replace the finisher control PWB. Readjust the finisher. (Use SIM3-10,Finisher control PWB DIP SW adjustment.)
Code;F1-50
Description;Main unit - Finisher combination error
Causes;The finisher which is not supported by the main unit model is installed. Finisher control PWB trouble.
Remedy;Install a proper finisher. Replace the finisher control PWB.
Code;F2-11
Description;Developing unit initial detection
Causes;The initial detection fuse is not blown off though it is conducted for the specified time. Developing unit trouble. PCU PWB trouble. Connection trouble of the connector and the harness.
Remedy;Use SIM6-51 to check the operation of the [DVCRU K] fuse blowing circuit. Use SIM30-1 to check the [DVCRU K] initial detection input signal. Replace the developing unit. Replace the PCU PWB. Check connection of the connector and the harness.
Code;F2-15
Description;Drum unit initial detection trouble
Causes;When the newly installed drum is driven for the specified time after installation, the new state is not canceled. Detection switch [DRCRU-K] trouble Process cartridge trouble. PCU PWB trouble. Connection trouble of the connector and the harness.
Remedy;Use SIM30-1 to check the operation of the [DRCRU-K] switch. Replace the process (drum) cartridge. Replace the PCU PWB. Check connection of the connector and the harness.
Code;F2-19
Description;Primary transfer unit initial detection trouble
Causes;When the newly installed primary transfer unit is driven for the specified time after installation, the new state is not canceled. 1TUD K sensor trouble Primary transfer initial operation clutch mechanism trouble Primary transfer unit initial detection level trouble PCU PWB trouble. Connection trouble of the connector and the harness. Primary transfer belt unit trouble.
Remedy;Use SIM30-1 to check the operation of the 1TUD-K sensor. Use SIM6-3 to check the switching operation of the primary transfer unit. Check to confirm that the initial detection level is inclined. Replace the PCU PWB. Check connection of the connector and the harness. Replace the primary transfer unit.
Code;F2-21
Description;Secondary transfer unit initial detection trouble
Causes;When the newly installed secondary transfer unit is driven for the specified time after installation, the new state is not canceled. PCU PWB trouble. Connection trouble of the connector and the harness. Secondary transfer UN initial detection mechanism trouble Initial detection electrode trouble Secondary transfer unit trouble.
Remedy;Check conduction of the initial detection electrode plate and the initial detection GND electrode plate. Replace the PCU PWB. Check connection of the connector and the harness. Replace the secondary transfer unit.
Code;F2-22
Description;Discharge lamp trouble
Causes;Contact trouble between the discharge lamp PWB and the PCU PWB. Discharge lamp PWB trouble. PCU PWB trouble.
Remedy;Replace the discharge lamp PWB. Check the harness and the connector. Replace the PCU PWB.
Code;F2-26
Description;Auto toner density control level setting trouble
Causes;The toner density sample level is not in the specified range when the automatic toner density control level is set. Toner density sensor trouble. Developing unit trouble. PCU PWB trouble. Connection trouble of the connector and the harness.
Remedy;When the power is turned OFF/ON, the automatic developer adjustment is executed again. Replace the developer cartridge. Replace the PCU PWB. Check connection of the connector and the harness.
Code;F2-39
Description;Process thermistor trouble
Causes;Process thermistor trouble. Process thermistor harness connection trouble. PCU PWB trouble
Remedy;Replace the process thermistor. Check connection of the harness and the connector. Replace the PCU PWB.
Code;F2-40
Description;Toner density sensor trouble
Causes;Toner density sensor output abnormality (Sample level 34 or less, or 221 or above) Harness and connector connection trouble. Developing unit trouble. PCU PWB trouble
Remedy;Replace the toner density sensor. Check connection of the connectors and the harness. Replace the developing unit. Replace the PCU PWB.
Code;F2-45
Description;Secondary transfer separation trouble
Causes;Image density sensor trouble. Harness connection trouble between the PCU PWB and the image density sensor. Image density sensor dirt. Transfer belt cleaning trouble. Calibration plate operation trouble.
Remedy;Replace the image density sensor. Check connection of the connectors and the harness. Clean the image density sensor. Replace the calibration plate. Replace the PCU PWB.
Code;F2-49
Description;LSU thermistor trouble
Causes;The LSU detection temperature is outside of -28C - 78C. LSU thermistor trouble. Harness and connector connection trouble. PCU PWB trouble LSU control PWB trouble.
Remedy;Replace the LSU thermistor. Check connection of the connectors and the harness. Replace the PCU PWB. Replace the LSU control PWB. Replace the LSU.
Code;F2-50
Description;Drum phase sensor trouble
Causes;Drum phase sensor trouble. Harness and connector connection trouble. Drum drive section trouble. PCU PWB trouble
Remedy;"Use SIM30-1 to check the operation of ""DHPD_K."". Replace the drum phase sensor. Check connection of the connectors and the harness. Repair the drum drive section. Replace the PCU PWB."
Code;F2-58
Description;Process humidity sensor trouble
Causes;Process humidity sensor trouble. Harness and connector connection trouble. PCU PWB trouble.
Remedy;Replace the process humidity sensor. Check connection of the connectors and the harness. Replace the PCU PWB.
Code;F2-64
Description;Toner supply operation trouble
Causes;Toner motor trouble. Toner density sensor trouble. Connector/harness trouble. PCU PWB trouble. Toner cartridge trouble. Developing unit trouble.
Remedy;Replace the toner motor. Replace the toner density sensor. Connector and harness check. Replace the PCU PWB. Replace the toner cartridge. Replace the developing unit.
Code;F2-70
Description;Improper toner cartridge detection
Causes;An improper toner cartridge is inserted. (The main unit detects a toner cartridge of a different specification.) Toner cartridge trouble. PCU PWB trouble
Remedy;Replace the toner cartridge. Replace the PCU PWB.
Code;F2-74
Description;Toner cartridge CRUM error
Causes;Toner cartridge (CRUM) trouble. PCU PWB trouble. Connector/harness trouble.
Remedy;Replace the toner cartridge. Replace the PCU PWB. Connector/harness trouble.
Code;F2-78
Description;Image density sensor trouble
Causes;Image density sensor trouble. Harness connection trouble between the PCU PWB and the image density sensor. Image density sensor dirt. Calibration plate dirt. Calibration plate solenoid operation trouble.
Remedy;Replace the image density sensor. Check connection of the connectors and the harness. Replace the image density sensor. Calibration plate solenoid operation check.
Code;F3-12
Description;Paper feed tray 1 lift operation trouble
Causes;LUD1 is not turned ON within the specified time. CLUD1 sensor trouble Paper feed tray 1 lift unit trouble. PCU PWB trouble. Harness and connector connection trouble.
Remedy;Check connection of the harness and the connector of LUD1. Replace the lift-up unit. Replace the PCU PWB.
Code;H2-00
Description;Thermistor open trouble (TH_UM_AD2)
Causes;Thermistor trouble. PCU PWB trouble Connection trouble of the connector and the harness. Fusing unit not installed.
Remedy;Replace the thermistor. Replace the PCU PWB. Harness and connector connection trouble.
Code;H2-01
Description;Thermistor open trouble (TH_LM)
Causes;Thermistor trouble. PCU PWB trouble. Connection trouble of the connector and the harness. Fusing unit not installed.
Remedy;Replace the thermistor. Replace the PCU PWB. Harness and connector connection trouble.
Code;H2-02
Description;Sub thermistor open trouble (TH_US)
Causes;Thermistor trouble. PCU PWB trouble. Connection trouble of the connector and the harness. Fusing unit not installed.
Remedy;Replace the thermistor. Replace the PCU PWB. Harness and connector connection trouble.
Code;H2-03
Description;Compensation thermistor open trouble (TH_UM_AD1)
Causes;Thermistor trouble. PCU PWB trouble Connection trouble of the connector and the harness. Fusing unit not installed.
Remedy;Replace the thermistor. Replace the PCU PWB. Harness and connector connection trouble.
Code;H2-04
Description;Thermistor open (TH_EX1)
Causes;Thermistor trouble. PCU PWB trouble. Connection trouble of the connector and the harness. Fusing unit not installed.
Remedy;Replace the thermistor. Replace the PCU PWB. Harness and connector connection trouble.
Code;H2-05
Description;Thermistor open (TH_EX2)
Causes;Thermistor trouble. PCU PWB trouble. Connection trouble of the connector and the harness. Fusing unit not installed.
Remedy;Replace the thermistor. Replace the PCU PWB. Harness and connector connection trouble.
Code;H3-00
Description;Fusing section high temperature trouble (TH_UM)
Causes;The fusing temperature exceeds the specified level. Thermistor trouble. PCU PWB trouble Connection trouble of the connector and the harness. Power unit trouble.
Remedy;Use SIM5-2 to check the flashing operation of the heater lamp. Use SIM14 to cancel the trouble. Replace the thermistor. Replace the PCU PWB. Harness and connector connection trouble. Replace the power unit. Error cancel method SIM14
Code;H3-01
Description;Fusing section high temperature trouble (TH_LM)
Causes;The fusing temperature exceeds the specified level. Thermistor trouble. PCU PWB trouble.Harness and connector connection trouble. Power unit trouble.
Remedy;Use SIM5-2 to check the flashing operation of the heater lamp. Use SIM14 to cancel the trouble. Replace the thermistor. Replace the PCU PWB. Harness and connector connection trouble. Replace the power unit. Error cancel method SIM14
Code;H3-02
Description;Fusing section high temperature trouble (TH_US)
Causes;The fusing temperature exceeds the specified level. Thermistor trouble. PCU PWB trouble Connection trouble of the connector and the harness. Power unit trouble.
Remedy;Use SIM5-2 to check the flashing operation of the heater lamp. Use SIM14 to cancel the trouble. Replace the thermistor. Replace the PCU PWB. Harness and connector connection trouble. Replace the power unit. Error cancel method SIM14
Code;H3-04
Description;Fusing section high temperature trouble (TH_EX1)
Causes;The fusing temperature exceeds the specified level. Thermistor trouble. PCU PWB trouble. Connection trouble of the connector and the harness. Power unit trouble. Fusing unit not installed.
Remedy;Replace the power unit. Replace the PCU PWB. Harness and connector connection trouble. Use SIM14 to cancel the trouble. Error cancel method SIM14
Code;H3-05
Description;Fusing section high temperature trouble (TH_EX2)
Causes;The fusing temperature exceeds the specified level. Thermistor trouble. PCU PWB trouble. Connection trouble of the connector and the harness. Power unit trouble.
Remedy;Replace the thermistor. Replace the PCU PWB. Harness and connector connection trouble. Replace the power unit. Use SIM14 to cancel the trouble. Error cancel method SIM14
Code;H4-00
Description;Fusing section low temperature trouble (TH_UM_AD2)
Causes;The fusing temperature does not reach the specified level within the specified time from turning ON the power relay. Thermistor trouble. Heater lamp trouble. PCU PWB trouble. Thermostat trouble. Connector, harness connection trouble. Power unit trouble. Interlock switch trouble.
Remedy;Replace the thermistor. Replace the heater lamp. Replace the PCU PWB. Replace the thermostat. Check connection of the connector and the harness. Replace the power unit. Replace the interlock switch. Use SIM5-2 to check the flashing operation of the heater lamp. Use SIM14 to cancel the trouble. Error cancel method SIM14
Code;H4-01
Description;Fusing section low temperature trouble (TH_LM)
Causes;The fusing temperature does not reach the specified level within the specified time from turning ON the power relay. Thermistor trouble. Heater lamp trouble. PCU PWB trouble Thermostat trouble. Connector, harness connection trouble. Power unit trouble. Interlock switch trouble.
Remedy;Replace the thermistor. Replace the heater lamp. Replace the PCU PWB. Replace the thermostat. Check connection of the connector and the harness. Replace the power unit. Replace the interlock switch. Use SIM5-2 to check the flashing operation of the heater lamp. Use SIM14 to cancel the trouble. Error cancel method SIM14
Code;H4-02
Description;Fusing section low temperature trouble (TH_US)
Causes;The fusing temperature does not reach the specified level within the specified time from turning ON the power relay. Thermistor trouble. Heater lamp trouble. PCU PWB trouble Thermostat trouble. Connector, harness connection trouble. Power unit trouble. Interlock switch trouble.
