Remedy;1. Close the RADF jam access cover or the front cover if they are opened in the read ready status. 2. Is the RADF jam access cover sensor working? (Perform the input check: 03-[FAX]ON/[7]/[C]) 3. Check if the connector CN75 on the RADF board is disconnected from the RADF jam access cover sensor or the harnesses are open circuited. Correct if any. 4. Replace the RADF jam access cover sensor. 5. Replace the RADF board.
Code;E910
Description;Jam at the bridge unit transport sensor-1: The paper does not reach the bridge unit transport sensor-1 after it has passed the exit sensor.
Remedy;1. Check if there is any paper in the bridge unit and remove it if there is. 2. Is the bridge unit transport sensor-1 working? (Perform the input check:03-[FAX]OFF/[3]/[F]) / 03- [FAX]OFF/[4]/[F]) * If it is working properly, proceed to 6. If not, check 3 to 5 below. 3. Check if the connector CN302 on the LGC board is disconnected from the bridge unit transport sensor-1 (entrance sensor) or the harnesses are open circuited. Check if the connector J681 of the bridge unit is disconnected. Correct if any. 4. Replace the bridge unit transport sensor-1. 5. Replace the LGC board. 6. Is the bridge unit gate solenoid working? (Perform the output check: 03-232) * If it is working properly, proceed to 10. If not, check 7 to 9 below. 7. Check if the connector CN302 on the LGC board is disconnected from the bridge unit gate solenoid or the harnesses are open circuited. Check if the connector J681 of the bridge unit is disconnected. Correct if any. 8. Replace the bridge unit gate solenoid. 9. Replace the LGC board. 10.Does the transport roller of the bridge unit work when the fuser motor is rotated? (Perform the output check: 03-113/163) * If it is working properly, proceed to 12. If not, check 11 below. 11.Check the drive system of the equipment and bridge unit. 12.Check if the rollers in the exit roller, the pressure spring and the bridge unit are worn out.
Code;E920
Description;Stop jam at the bridge unit transport sensor-1: The trailing edge of the paper does not pass the bridge unit transport sensor-1 after its leading edge has reached the sensor.
Remedy;1. Check if there is any paper in the bridge unit and remove it if there is. 2. Is the bridge unit transport sensor-1 working? (Perform the input check:03-[FAX]OFF/[3]/[F]) / 03- [FAX]OFF/[4]/[F]) * If it is working properly, proceed to 6. If not, check 3 to 5 below. 3. Check if the connector CN302 on the LGC board is disconnected from the bridge unit transport sensor-1 (entrance sensor) or the harnesses are open circuited. Check if the connector J681 of the bridge unit is disconnected. Correct if any. 4. Replace the bridge unit transport sensor-1. 5. Replace the LGC board. 6. Is the bridge unit gate solenoid working? (Perform the output check: 03-232) * If it is working properly, proceed to 10. If not, check 7 to 9 below. 7. Check if the connector CN302 on the LGC board is disconnected from the bridge unit gate solenoid or the harnesses are open circuited. Check if the connector J681 of the bridge unit is disconnected. Correct if any. 8. Replace the bridge unit gate solenoid. 9. Replace the LGC board. 10.Does the transport roller of the bridge unit work when the fuser motor is rotated? (Perform the output check: 03-113/163) * If it is working properly, proceed to 12. If not, check 11 below. 11.Check the drive system of the equipment and bridge unit. 12.Check if the rollers in the exit roller, the pressure spring and the bridge unit are worn out.
Code;E930
Description;Jam at the bridge unit transport sensor-2: The trailing edge of the paper does not reach the bridge unit transport sensor-2 after its leading edge has reached the bridge unit transport sensor-1.
Remedy;1. Check if there is any paper in the bridge unit and remove it if there is. 2. Is the bridge unit transport sensor-2 working? (Perform the input check:03-[FAX]OFF/[5]/[D]) * If it is working properly, proceed to 6. If not, check 3 to 5 below. 3. Check if the connector CN334 on the LGC board is disconnected from the bridge unit transport sensor-2 (exit sensor) or the harnesses are open circuited. Check if the connector J523 of the bridge unit is disconnected. Correct if any. 4. Replace the bridge unit transport sensor-2. 5. Replace the LGC board. 6. Does the transport roller of the bridge unit work when the fuser motor is rotated? (Perform the output check: 03-113/163) * If it is working properly, proceed to 8. If not, check 7 below. 7. Check the drive system of the equipment and bridge unit. 8. Check if the rollers in the exit roller, the pressure spring and the bridge unit are worn out.
Code;E940
Description;Stop jam at the bridge unit transport sensor-2: The trailing edge of the paper does not reach the bridge unit transport sensor-2 after its leading edge has reached the bridge unit transport sensor-2.
Remedy;1. Check if there is any paper in the bridge unit and remove it if there is. 2. Is the bridge unit transport sensor-2 working? (Perform the input check:03-[FAX]OFF/[5]/[D]) * If it is working properly, proceed to 6. If not, check 3 to 5 below. 3. Check if the connector CN334 on the LGC board is disconnected from the bridge unit transport sensor-2 (exit sensor) or the harnesses are open circuited. Check if the connector J523 of the bridge unit is disconnected. Correct if any. 4. Replace the bridge unit transport sensor-2. 5. Replace the LGC board. 6. Does the transport roller of the bridge unit work when the fuser motor is rotated? (Perform the output check: 03-113/163) * If it is working properly, proceed to 8. If not, check 7 below. 7. Check the drive system of the equipment and bridge unit. 8. Check if the rollers in the exit roller, the pressure spring and the bridge unit are worn out.
Code;E950
Description;Jam not reaching the job separator transport sensor: The paper has passed through the exit sensor does not reach the job separator transport sensor.
Remedy;Open the JSP cover. Is there any paper on the transport path? YES Remove the paper. NO Is the JSP feed sensor working? (Perform the input check in the test mode: 03-[FAX]ON/[3]/[D]) NO 1. Check if the connector of the JSP feed sensor is disconnected. 2. Check if either of the connectors CN260 or CN262 on the JSP board is disconnected. 3. Check if the connector CN302 on the LGC board is disconnected. 4. Check if the connector pins are disconnected and the harnesses are open circuited. 5. Check if the conductor patterns on the JSP board and LGC board are short circuited or open circuited. 6. Replace the JSP feed sensor. 7. Replace the JSP board. 8. Replace the LGC board. YES 1. Replace the JSP board. 2. Replace the LGC board.
Code;E951
Description;Stop jam at the job separator transport sensor: The trailing edge of the paper does not pass the job separator transport sensor
Remedy;Open the JSP cover. Is there any paper on the transport path? YES Remove the paper. NO Is the JSP feed sensor working? (Perform the input check in the test mode: 03-[FAX]ON/[3]/[D]) NO 1. Check if the connector of the JSP feed sensor is disconnected. 2. Check if either of the connectors CN260 or CN262 on the JSP board is disconnected. 3. Check if the connector CN302 on the LGC board is disconnected. 4. Check if the connector pins are disconnected and the harnesses are open circuited. 5. Check if the conductor patterns on the JSP board and LGC board are short circuited or open circuited. 6. Replace the JSP feed sensor. 7. Replace the JSP board. 8. Replace the LGC board. YES 1. Replace the JSP board. 2. Replace the LGC board.
Code;E960
Description;Jam not reaching the offset tray transport sensor: The paper has passed through the exit sensor does not reach the offset tray transport sensor.
Remedy;Open the OCT cover. Is there any paper on the transport path? YES Remove the paper. NO Is the OCT feed sensor working? (Perform the input check in the test mode: 03-[FAX]ON/[3]/[G]) NO 1. Check if the connector of the OCT feed sensor is disconnected. 2. Check if either of the connectors CN260 or CN262 on the OCT board is disconnected. 3. Check if the connector CN302 on the LGC board is disconnected. 4. Check if the connector pins are disconnected and the harnesses are open circuited. 5. Check if the conductor patterns on the OCT board and LGC board are short circuited or open circuited. 6. Replace the OCT feed sensor. 7. Replace the OCT board. 8. Replace the LGC board. YES 1. Replace the OCT board. 2. Replace the LGC board.
Code;E961
Description;Stop jam at the offset tray transport sensor: The trailing edge of the paper does not pass the offset tray transport sensor.
Remedy;Open the OCT cover. Is there any paper on the transport path? YES Remove the paper. NO Is the OCT feed sensor working? (Perform the input check in the test mode: 03-[FAX]ON/[3]/[G]) NO 1. Check if the connector of the OCT feed sensor is disconnected. 2. Check if either of the connectors CN260 or CN262 on the OCT board is disconnected. 3. Check if the connector CN302 on the LGC board is disconnected. 4. Check if the connector pins are disconnected and the harnesses are open circuited. 5. Check if the conductor patterns on the OCT board and LGC board are short circuited or open circuited. 6. Replace the OCT feed sensor. 7. Replace the OCT board. 8. Replace the LGC board. YES 1. Replace the OCT board. 2. Replace the LGC board.
Code;E9F0
Description;Punching jam: Punching is not performed properly. [MJ-1025 (When MJ-6005 is installed)] Punching jam: Punching is not performed properly. [MJ-1024 (when MJ-6004 is installed)] [MJ-1101 (when MJ-6101 is installed)]
Remedy;MJ-1025 Is there any paper remaining on the transport path in the finisher or equipment? YES Remove the paper. NO Is the connector J1006 on the punch controller PC board disconnected? Is the harness connecting the punch controller PC board and punch home position sensor (PI1P) open circuited? YES Connect the connector securely. Replace the harness. NO Is the punch home position sensor working properly? l NO 1. Connect the connector of the punch home position sensor securely. 2. Replace the punch home position sensor. YES Replace the punch controller PC board. MJ-1024 (when MJ-6004 is installed) 1. Check if there is any paper in the finisher or the on the transport path of the equipment. Remove it if there is. 2. Is the connector J605A on the punch controller PC board disconnected? 3. Check if the connector on the punch controller PC board is disconnected from the punch home position sensor (PI63) or the harnesses are open circuited. Correct if any. 4. Check if the punch home position sensor (PI63) is working properly. 5. Replace the punch home position sensor. 6. Replace the punch controller PC board. MJ-1101 (when MJ-6101 is installed) 1. Check if there is any paper in the finisher, saddle stitcher or the on the transport path of the equipment. Remove it if there is. 2. Rotate the punch motor (M3) and fix its mechanism if it does not rotate smoothly. 3. Check if the harnesses and the punch HP sensor (S4) are connected properly. Correct if any. 4. Check if the wiring of the hole punch controller PC board (HP board) and the punch motor (M3) is proper. Correct if any. 5. Replace the punch motor (M3). 6. Replace the hole punch control PC board.
Code;EA10
Description;Paper transport delay jam: The paper which has passed the bridge unit does not reach the inlet sensor. Paper transport delay jam: The paper which has passed the bridge unit does not reach the inlet sensor. [MJ-1024/1031/1101]
Remedy;MJ-1025 1. Check if there is any paper remaining in the Finisher or on the transport path of the equipment. Remove if there is. 2. Check if the connector pins are disconnected or the harnesses are open circuited between the inlet sensor and the connector on the finisher controller PC board. Correct if there is any abnormality. 3. Check if the inlet sensor is working normally. (Correct if the actuator does not return normally or if it is deformed or removed.) 4. Replace the sensor. 5. Replace the finisher controller PC board. MJ-1024 1. Check if there is any paper in the finisher or on the transport path of the equipment and remove it if there is. 2. Check if the connector J708 on the finisher controller PC board is disconnected from the inlet sensor (P133) or the harnesses are open circuited. Correct if any. 3. Is the inlet sensor working properly? (Check the movement of the actuator.) 4. Replace the inlet sensor. 5. Replace the finisher controller PC board. MJ-1031 1. Check if there is any paper in the finisher or on the transport path of the equipment and remove it if there is. 2. Check if the connector J104 on the finisher controller PC board is disconnected from the inlet sensor (SR2) or the harnesses are open circuited. Correct if any. 3. Is the inlet sensor working properly? (Check the movement of the actuator.) 4. Replace the inlet sensor. 5. Replace the finisher controller PC board. MJ-1101 1. Check if there is any paper in the finisher or on the transport path of the equipment and remove it if there is. 2. Is there a disconnection of the connector, incorrect installation or breakage of the entrance sensor (S1)? 3. Is the gap between the flapper and entrance roller shaft other than 0.60?0.20mm when the gate solenoid (SOL2) is pulled?. 4. Is the harness between the entrance motor (M1) and the finisher control PC board (CN7) disconnected or open circuited? 5. Is the harness between the gate solenoid (SOL2) and the finisher control PC board (CN22) disconnected or open circuited? 6. Replace the finisher controller PC board.
Code;EA20
Description;Paper transport stop jam: The paper does not pass through the inlet sensor. [MJ-1025/MJ-1031] Paper transport stop jam: The paper has passed through the inlet sensor but does not reach or pass the feed path sensor or processing tray sensor. [MJ-1024] Paper transport delay jam: The paper which has passed through the inlet sensor does not reach the transport sensor. [MJ- 1101
Remedy;MJ-1025 Is there any paper remaining on the transport path in the finisher? YES Remove the paper. NO Is the connector CN16 (inlet sensor) on the finisher controller PC board disconnected? Is the harness connecting the finisher controller PC board and inlet sensor open-circuited? YES Connect the connector securely. Replace the harness. NO Is the inlet sensor working normally? (Check the movement of the actuator.) l NO 1. Attach the actuator securely if its shaft is out of place. 2. Replace the sensor. YES Replace the finisher controller PC board. MJ-1024 1. Check if there is any paper in the finisher or on the transport path of the equipment and remove it if there is. 2. Check if the connectors J707, J708 and J722B on the finisher controller PC board are disconnected from the corresponding sensors(inlet sensor [P133], transport path sensor [P134] and processing tray sensor [P138]) or the harnesses are open circuited. Correct if any. 3. Attach the actuators securely if their shafts are out of place. 4. Replace the sensors. 5. Replace the finisher controller PC board. MJ-1031 1. Check if there is any paper in the finisher or on the transport path of the equipment and remove it if there is. 2. Check if the connector J104 on the finisher controller PC board is disconnected from the inlet sensor (SR2) or the harnesses are open circuited. Correct if any. 3. Is the inlet sensor working properly? (Check the movement of the actuator.) 4. Replace the inlet sensor. 5. Replace the finisher controller PC board. MJ-1101 1. Check if there is any paper in the finisher or on the transport path of the equipment and remove it if there is. 2. Check if the connector on the finisher controller PC board is disconnected from the transport sensor (S2) or the harnesses are open circuited. Correct if any. 3. Replace the sensor. 4. Replace the finisher controller PC board.
Code;EA21
Description;Paper size error jam: Paper does not reach the sensor because the paper is shorter than spec.
Remedy;MJ-1101 1. Check if there is any paper in the finisher or on the transport path of the equipment and remove it if there is. 2. Is the paper size used shorter than the size specified in the specifications? 3. Check if the connectors CN7 and CN22 on the finisher controller PC board are disconnected from the entrance sensor (S1) and the transport sensor (S2), or the harnesses are open circuited. Correct if any. 4. Replace the sensor. 5. Replace the finisher controller PC board.
Code;EA22
Description;Paper transport jam (Finisher paper punching edge detection sensor)
Remedy;MJ-1101 1. Check if there is any paper in the finisher or on the transport path of the equipment and remove it if there is. 2. Is the paper size used shorter than the size specified in the specifications? 3. Check if the connectors CN7 and CN22 on the finisher controller PC board are disconnected from the entrance sensor (S1) and the transport sensor (S2), or the harnesses are open circuited. Correct if any. 4. Replace the sensor. 5. Replace the finisher controller PC board.
Code;EA23
Description;Paper transport jam (exit sensor)
Remedy;MJ-1101 1. Check if there is any paper in the finisher or on the transport path of the equipment and remove it if there is. 2. Check if the connectors CN7 and CN22 on the finisher controller PC board are disconnected from the entrance sensor (S1) and the transport sensor (S2), or the harnesses are open circuited. Correct if any. 3. Replace the sensor. 4. Replace the finisher controller PC board.
Code;EA24
Description;Paper transport jam (between entrance and exit sensors)
Remedy;MJ-1101 1. Check if there is any paper in the finisher or on the transport path of the equipment and remove it if there is. 2. Check if the connectors CN7 and CN22 on the finisher controller PC board are disconnected from the entrance sensor (S1) and the transport sensor (S2), or the harnesses are open circuited. Correct if any. 3. Replace the sensor. 4. Replace the finisher controller PC board.
Code;EA25
Description;Paper transport jam (after paper stack exit)
Remedy;MJ-1101 1. Check if there is any paper in the finisher or on the transport path of the equipment and remove it if there is. 2. Check if the connectors CN7 and CN22 on the finisher controller PC board are disconnected from the entrance sensor (S1) and the transport sensor (S2), or the harnesses are open circuited. Correct if any. 3. Replace the sensor. 4. Replace the finisher controller PC board.
Code;EA26
Description;Paper transport jam (stop command request)
Remedy;MJ-1101 1. Check if there is any paper in the finisher or on the transport path of the equipment and remove it if there is. 2. Check if the connectors CN7 and CN22 on the finisher controller PC board are disconnected from the entrance sensor (S1) and the transport sensor (S2), or the harnesses are open circuited. Correct if any. 3. Replace the sensor. 4. Replace the finisher controller PC board.
Code;EA27
Description;Paper transport jam (paper not inserted)
Remedy;MJ-1101 1. Check if there is any paper in the finisher or on the transport path of the equipment and remove it if there is. 2. Check if the connectors CN7 and CN22 on the finisher controller PC board are disconnected from the entrance sensor (S1) and the transport sensor (S2), or the harnesses are open circuited. Correct if any. 3. Replace the sensor. 4. Replace the finisher controller PC board.
Code;EA28
Description;Paper transport jam (assisting arm operation delay)
Remedy;MJ-1101 1. Check if there is any paper in the finisher or on the transport path of the equipment and remove it if there is. 2. Check if the connectors CN7 and CN22 on the finisher controller PC board are disconnected from the entrance sensor (S1) and the transport sensor (S2), or the harnesses are open circuited. Correct if any. 3. Replace the sensor. 4. Replace the finisher controller PC board.
Code;EA29
Description;Paper transport jam (stack transport delay)
Remedy;MJ-1101 1. Check if there is any paper in the finisher or on the transport path of the equipment and remove it if there is. 2. Check if the connectors CN7 and CN22 on the finisher controller PC board are disconnected from the entrance sensor (S1) and the transport sensor (S2), or the harnesses are open circuited. Correct if any. 3. Replace the sensor. 4. Replace the finisher controller PC board.
Code;EA30
Description;Power-ON jam: Paper exists at the inlet sensor when power is turned ON.
Remedy;MJ-1025 1. Check if there is any paper remaining in the Finisher or the Saddle Stitch Finisher or on the transport path of the equipment. Remove if there is. 2. Check if the connector pins are disconnected or the harnesses are open circuited between the inlet sensor and the connector on the finisher controller PC board. Correct if there is any abnormality. 3. Check if the harnesses are open circuited between the punch controller PC board and the photosensor PC board. Correct if there is any abnormality. 4. Are the inlet sensor, folding position sensor and photosensor PC board working properly? (Correct if the actuator does not return normally or if it is deformed 5. Replace the sensors. 6. Replace the finisher controller PC board. 7. Replace the punch controller PC board. MJ-1024 1. Check if there is any paper in the finisher or on the transport path of the equipment and remove it if there is. 2. Check if the connectors J707, J708 and J722B on the finisher controller PC board are disconnected from the corresponding sensor (inlet sensor [P133], transport path sensor [P134] and processing tray sensor [P138] ) or the harnesses are open circuited. Correct if any. 3. Is each of the sensors (the inlet sensor, the transport path sensor and the processing tray sensor) working properly? (Check the movement of the actuator.) 4. Replace the sensors. 5. Replace the finisher controller PC board. MJ-1031 1. Check if there is any paper in the finisher or on the transport path of the equipment and remove it if there is. 2. Check if the connector J104 on the finisher controller PC board is disconnected from the inlet sensor (SR2) or the harnesses are open circuited. Correct if any. 3. Is the inlet sensor working properly? (Check the movement of the actuator.) 4. Replace the inlet sensor. 5. Replace the finisher controller PC board.
Code;EA31
Description;Transport path paper remaining jam
Remedy;1. Check if there is any paper in the finisher or on the transport path of the equipment and remove it if there is. 2. Check if the connector CN22 on the finisher controller PC board is disconnected from the transport sensor (S2) or the harnesses are open circuited. Correct if any. 3. Check if the connectors CN7 and CN22 on the finisher controller PC board are disconnected from the inlet sensor (S1) and the transport sensor (S2), or the harnesses are open circuited. Correct if any. 4. Replace the sensor. 5. Replace the finisher controller PC board.
Code;EA32
Description;Exit paper remaining jam
Remedy;1. Check if there is any paper in the finisher or on the transport path of the equipment and remove it if there is. 2. Check and correct the mechanism. 3. Check if the connector CN11 on the finisher controller PC board is disconnected from the finishing tray paper detection sensor (S12) or the harnesses are open circuited. Correct if any. 4. Replace the sensor. 5. Replace the finisher controller PC board.
Code;EA40
Description;Door open jam: The Finisher is released from the equipment or any of the staple door and top cover is opened during printing. [MJ-1025] Door open jam: Any of the upper cover and front cover of the Finisher or any of the upper door and front door of the Hole Punch Unit is opened during printing. [MJ-1024] Joint open jam: The joint is released during printing or in the standby status. [MJ-1031]
