Remedy;MJ-1025 (when MJ-6005 is installed) Is the punch home position sensor (PI1P) working properly? NO Replace the sensor. YES Is the punch motor clock sensor (PI3P) working properly? NO Replace the sensor. YES Is the wiring between the finisher controller PC board and sensor correct? NO Correct the wiring. YES Is there any problem with the punching mechanism? YES Fix the mechanism. NO Replace Punch motor (M1P) Try replacing the punch controller PC board. Is the problem corrected? YES End. NO Replace the finisher controller PC board. MJ-1024 (when MJ-6004 is installed) Are the punch home position sensor (PI63) and punch motor clock sensor (PI62) working normally? NO Replace the sensors. YES Is the wiring between the sensors and punch controller PC board correct? NO Correct the wiring. YES Is the punching mechanism normal? NO Fix the mechanism. YES 1. Replace the punch motor (M61). 2. Replace the punch controller PC board. 3. Replace the finisher controller PC board.
Code;CC61
Description;Punch motor home position detection error
Remedy;MJ-1101 (When MJ-6101 is installed) Is there any paper remaining on the transport path? ..YES Remove the paper. NO Rotate the punch motor (M3). Does it rotate smoothly? ..NO Fix the mechanism. YES Are the punch home position sensor (S4) and its wiring correct? ..NO Replace the sensor. Correct the wiring. YES Is the wiring between the hole punch control PC board (HP) and punch motor (M3) correct? ..NO Correct the wiring. YES 1. Replace the punch motor (M3). 2. Replace the hole punch control PC board (HP).
Code;CC71
Description;Punch ROM checksum error
Remedy;MJ-1101 (When MJ-6101 is installed) Is the conductor pattern on the hole punch control PC board (HP) open circuited or short circuited? ..YES Replace the hole punch control PC board (HP). NO Replace the finisher control PC board.
Code;CC72
Description;Punch RAM read/write error
Remedy;MJ-1101 (When MJ-6101 is installed) Is the conductor pattern on the hole punch control PC board (HP) open circuited or short circuited? ..YES Replace the hole punch control PC board (HP). NO Replace the finisher control PC board.
Code;CC80
Description;Alignment motor (front) abnormality: The alignment motor (front) is not rotating normally or the front alignment plate is not moving normally. Front aligning plate motor abnormality: Front aligning plate motor is not rotating or aligning plate is not moving normally. [MJ-1024] Rear alignment motor abnormality: The rear alignment motor is not rotating or the rear alignment plate is not moving normally. [MJ-1101]
Remedy;MJ-1025 (Alignment motor (front) abnormality) Is the aligning plate home position sensor (front) (PI4) working properly? NO Replace the sensor. YES Is the wiring between the finisher controller PC board and alignment motor (front) (M4) correct? NO Correct the wiring. YES Is there any mechanical problem with the path of aligning plate? YES Fix the mechanism. NO Try replacing the alignment motor (front) (M4). Is the problem corrected? YES End. NO Replace the finisher controller PC board. MJ-1024 (Front aligning plate motor abnormality) Is the front aligning plate home position sensor (PI36) normal? NO Replace the sensor. YES Is the wiring between the finisher controller PC board and the front aligning plate motor (M33) correct? NO Correct the wiring. YES Is there any mechanical problem with the path of aligning plate? NO Fix the mechanism. YES 1. Replace the front aligning plate motor. 2. Replace the finisher controller PC board. MJ-1101 Is there any mechanical problem when the rear alignment plate is moved? ..YES Fix the mechanism. NO Is the harness between the rear alignment motor (M10) and the finisher control PC board (CN10) disconnected or open circuited? l ..YES • Reconnect the connector securely. • Replace the harness. NO 1. Replace the rear alignment motor (M10). 2. Replace the finisher control PC board.
Code;CC90
Description;Upper stack tray lift motor abnormality: The upper stack tray lift motor is not rotating or the upper stack tray is not moving normally. Tray shift motor abnormality: The tray shift motor is not rotating or the stack tray is not moving normally. [MJ- 1031]
Remedy;MJ-1031 Is the wiring between the finisher controller PC board and tray shift motor (M2) correct? NO Correct the wiring. YES Are the front and rear sides of the stack tray leveled? NO Level them. YES Is the tray clock sensor (SR9) working properly? NO Replace the sensor. YES Are the tray lower limit sensor (SR5), tray 500 sensor (SR4) and tray safety switch (SW2) working properly? NO Replace the sensor or sensor controller PC board. YES Does the voltage between the pins J114-1 and -2 on the finisher controller PC board become 24V when the tray shift motor starts rotating? NO Replace the finisher controller PC board. YES Check the wiring between the tray shift motor and finisher controller PC board. If there is no problem, replace the tray shift motor.
Code;CCB0
Description;Alignment motor (rear) abnormality: The alignment motor (rear) is not rotating normally or the rear alignment plate is not moving normally. [MJ-1025] Offset motor abnormality: The offset motor is not rotating normally. [MJ-1031]
Remedy;MJ-1025 Is the aligning plate home position sensor (rear) (PI5) working properly? NO Replace the sensor. YES Is the wiring between the finisher controller PC board and aligning plate home position sensor (rear) correct? NO Correct the wiring. YES Is there any mechanical problem with the path of aligning plate? YES Fix the mechanism. NO Try replacing the alignment motor (rear) (M5). Is the problem corrected? YES End. NO Replace the finisher controller PC board. MJ-1031 1. Check if the connector J104 on the finisher controller PC board is disconnected from the offset HP sensor (SR1) or the harnesses are open circuited. Correct if any. 2. Check if the connector J107 on the finisher controller PC board is disconnected from the offset motor (M5) or the harnesses are open circuited. Correct if any. 3. Replace the offset HP sensor. 4. Replace the offset motor. 5. Replace the finisher control PC board.
Code;CCD0
Description;Stack ejection motor abnormality: Stack ejection motor or stack ejection roller is not rotating normally. [MJ-1024]
Remedy;MJ-1024 Is the shutter home position sensor (PI45) normal? NO Replace the sensor. YES Are the wirings between the finisher controller PC board and the stack ejection motor (M32)/ shutter clutch (CL31) correct? NO Correct the wirings. YES Is there any problem with the shutter mechanism? YES.. Fix the shutter mechanism. NO 1. Replace the stack ejection motor and shutter clutch. 2. Replace the finisher controller PC board.
Code;CCE0
Description;Paper trailing edge assist motor abnormality: Paper trailing edge assist motor is not rotating or paper trailing edge assist is not moving normally. [MJ-1024]
Remedy;MJ-1024 Is the rear end assist guide home position sensor (PI39) normal? NO Replace the sensor. YES Is the wiring between the finisher controller PC board and the rear end assist motor (M39) correct? NO Correct the wiring. YES Is there any problem with the rear end assist mechanism? YES.. Fix the rear end assist mechanism. NO 1. Replace the rear end assist motor. 2. Replace the finisher controller PC board.
Code;CCF0
Description;Gear changing motor abnormality: Gear changing motor is not rotating normally. [MJ-1024]
Remedy;MJ-1024 Is the gear change home position sensor (PI49) normal? NO Replace the sensor. YES Is the wiring between the finisher controller PC board and the gear change motor (M40) correct? NO Correct the wiring. YES Is there any problem with the gear change mechanism? YES.. Fix the gear change mechanism. NO 1. Replace the gear change motor. 2. Replace the finisher controller PC board.
Code;CCF1
Description;Tray safety switch abnormality -  (1) The tray safety switch turned on during tray operation (moving up or down).  (2) The tray operated with the tray safety switch turned on. [MJ-1031]
Remedy;MJ-1024 1. Check if the connector J110 on the finisher controller PC board is disconnected from the tray safety switch (SW2) or the harnesses are open circuited. Correct if any. 2. Check if the connector J114 on the finisher controller PC board is disconnected from the stack tray shift motor (M2) or the harnesses are open circuited. Correct if any. 3. Replace the tray safety switch 4. Replace the stack tray shift motor. 5. Replace the finisher control PC board.
Code;CDC0
Description;Punch power failure abnormality: 24 V is not applied to the punch controller board. [MJ-1025 (when MJ-6005 is installed)]
Remedy;MJ-1025 Is the problem solved by turning the power of the equipment OFF and ON? YES End NO Is the wiring between the finisher controller PC board and punch controller PC board correct? NO Correct the wiring. YES Does the voltage between the CN14-5 (+) and CN14-3 (-) on the finisher controller PC board become 24 V? YES Replace the punch controller PC board. NO Replace the finisher controller PC board.
Code;CDD0
Description;Folding position sensor abnormality: Automatic adjustment of the folding position sensor can not be performed properly. [MJ-1025]
Remedy;MJ-1025 Is the folding position sensor (PI10) working properly? NO Replace the sensor. YES Is the wiring between the finisher controller PC board and folding position sensor (PI10) correct? NO Correct the wiring. YES Is there any mechanical problem with the fold jam releasing dial? YES Fix the mechanism. NO 1. Replace the staple/fold motor (M7). 2. Replace the finisher controller PC board.
Code;CDE0
Description;Paddle motor abnormality: The paddle motor does not rotate properly. [MJ-1025]
Remedy;MJ-1025 Is the paddle home position sensor (PI2) working properly? NO Replace the sensor. YES Is the Swing guide home position sensor (PI3) working properly? NO Replace the sensor. YES Is the wiring between the finisher controller PC board and Paddle motor (M2) correct? NO Correct the wiring. YES Try to rotate the paddle motor (M2) clockwise and counterclockwise by hand. Is there mechanical trapping in the rotation of the paddle or the up/down movement of the swing guide? YES Fix the mechanism. NO 1. Replace the paddle motor (M2) 2. Replace the finisher controller PC board. the initial operation. MJ-1101 Is there any mechanical problem with the paddle is rotated? ..YES Fix the mechanism. NO Is the harness between the paddle motor (M8) and the finisher control PC board (CN6) disconnected or open circuited? l ..YES • Reconnect the connector securely. • Replace the harness. NO 1. Replace the paddle motor (M8). 2. Replace the finisher control PC board.
Code;CDF0
Description;Initialization error of the offset tray: The home position of the separator cannot be detected when the power is turned ON.
Remedy;(1) Check if each connector between the offset gate motor and MOT2 board (CN406) is disconnected. (2) Check if each connector between the MOT2 board (CN406) and LGC board (CN302) is disconnected. (3) Check if each connector pin is removed or the harness is broken. (4) Check if any conductor pattern on the MOT2 board and LGC board is short circuited or open circuited. (5) Replace the offset gate motor. (6) Replace the MOT2 board. (7) Replace the LGC board.
Code;CE00
Description;Communication error between finisher unit and puncher unit: Communication error between the finisher controller PC board and punch controller PC board. [MJ-1025 (when MJ-6005 is installed)] Communication error between finisher and punch unit: Communication error between finisher controller PC board and punch controller PC board [MJ-1024 (when MJ-6004 is installed)] [MJ-1101 (when MJ-6101 is installed)]
Remedy;MJ-1025 (when MJ-6005 is installed) Is the problem solved by turning the power of the equipment OFF and ON? YES End. NO Is the wiring between the finisher controller PC board and the punch controller PC board correct? NO Correct the wiring. YES Measure the voltage between CN14-5 (+) and CN14-3 (-) on the finisher controller PC board 24 V? NO Replace the finisher controller PC board. YES Replace the punch controller PC board. MJ-1024 (When MJ-6004 is installed) Is the problem solved by turning OFF and ON the power of the equipment? YES.. End. NO Is the wiring between the finisher controller PC board and punch controller PC board correct? NO Correct the wiring. YES 1. Replace the finisher controller PC board. 2. Replace the punch controller PC board. MJ-1101 (When MJ-6101 is installed) Is the harness between the hole punch control PC board (HP) and the finisher control PC board disconnected or open circuited? ..YES Replace the harness. Correct the wiring. NO Is the conductor pattern on the hole punch control PC board (HP) open circuited or short circuited? ..YES Replace the hole punch control PC board (HP). NO Replace the finisher control PC board.
Code;CE50
Description;Temperature/humidity sensor abnormality: The output value of this sensor is out of a specified range.
Remedy;MJ-1025 (when MJ-6005 is installed) Is the problem solved by turning the power of the equipment OFF and ON? YES End. NO Is the wiring between the finisher controller PC board and the punch controller PC board correct? NO Correct the wiring. YES Measure the voltage between CN14-5 (+) and CN14-3 (-) on the finisher controller PC board 24 V? NO Replace the finisher controller PC board. YES Replace the punch controller PC board. MJ-1024 (When MJ-6004 is installed) Is the problem solved by turning OFF and ON the power of the equipment? YES.. End. NO Is the wiring between the finisher controller PC board and punch controller PC board correct? NO Correct the wiring. YES 1. Replace the finisher controller PC board. 2. Replace the punch controller PC board. MJ-1101 (When MJ-6101 is installed) Is the harness between the hole punch control PC board (HP) and the finisher control PC board disconnected or open circuited? ..YES Replace the harness. Correct the wiring. NO Is the conductor pattern on the hole punch control PC board (HP) open circuited or short circuited? ..YES Replace the hole punch control PC board (HP). NO Replace the finisher control PC board.
Code;CE90
Description;Drum thermistor abnormality: The output value of the drum thermistor-K is out of a specified range.
Remedy;MJ-1025 (when MJ-6005 is installed) Is the problem solved by turning the power of the equipment OFF and ON? YES End. NO Is the wiring between the finisher controller PC board and the punch controller PC board correct? NO Correct the wiring. YES Measure the voltage between CN14-5 (+) and CN14-3 (-) on the finisher controller PC board 24 V? NO Replace the finisher controller PC board. YES Replace the punch controller PC board. MJ-1024 (When MJ-6004 is installed) Is the problem solved by turning OFF and ON the power of the equipment? YES.. End. NO Is the wiring between the finisher controller PC board and punch controller PC board correct? NO Correct the wiring. YES 1. Replace the finisher controller PC board. 2. Replace the punch controller PC board. MJ-1101 (When MJ-6101 is installed) Is the harness between the hole punch control PC board (HP) and the finisher control PC board disconnected or open circuited? ..YES Replace the harness. Correct the wiring. NO Is the conductor pattern on the hole punch control PC board (HP) open circuited or short circuited? ..YES Replace the hole punch control PC board (HP). NO Replace the finisher control PC board.
Code;CF10
Description;Communication module SRAM reading failure. [MJ-1101]
Remedy;MJ-1101 1. Is the error recovered when the power of the equipment is turned OFF and then back ON? 2. Check if the MJ-1101 is set as the specified finisher on the equipment. 3. Check if the harness connecting the converter PC board and the finisher controller PC board is disconnected or open circuited. 4. Check if the conductor pattern on the converter PC board is open circuited or short circuited. 5. Check if the conductor pattern on the finisher controller PC board is open circuited or short circuited. 6. Replace the converter PC board. 7. Replace the finisher control PC board. MJ-1101 (When MJ-6101 is installed) 1. Is the error recovered when the power of the equipment is turned OFF and then back ON? 2. Check if the MJ-1101 is set as the specified finisher on the equipment. 3. Check if the harness connecting the converter PC board and the finisher controller PC board is disconnected or open circuited. 4. Check if the harness connecting the hole punch control PC board and the finisher control PC board is disconnected or open circuited. 5. Check if the conductor pattern on the converter PC board is open circuited or short circuited. 6. Check if the conductor pattern on the finisher controller PC board is open circuited or short circuited. 7. Check if the conductor pattern on the hole punch control PC board is open circuited or short circuited. 8. Replace the converter PC board. 9. Replace the finisher control PC board. 10.Replace the hole punch control PC board.
Code;E010
Description;Jam not reaching the exit sensor: The paper which has passed through the fuser unit does not reach the exit sensor.
Remedy;Open the Automatic duplexing unit. Is there any paper on the transport path? YES Remove the paper. NO Is the exit sensor working? (Perform the input check in the test mode: 03-[FAX]ON/[9]/[B]) NO 1. Check if the connector of the exit sensor is disconnected. 2. Check if the connector CN309 on the LGC board is disconnected. 3. Check if the connector pins are disconnected and the harnesses are open circuited. 4. Check if the conductor pattern on the LGC board is short circuited or open circuited. 5. Replace the exit sensor. 6. Replace the LGC board. YES Is the registration roller clutch working? (Perform the output check in the test mode: 03-108/158) NO 1. Check if the connector of the registration roller clutch is disconnected. 2. Check if the connector CN315 on the LGC board is disconnected. 3. Check if the connector pins are disconnected and the harnesses are open circuited. 4. Check if the conductor pattern on the LGC board is short circuited or open circuited. 5. Replace the registration roller clutch. 6. Replace the LGC board. YES Check the registration roller. Replace it if it is worn out.
Code;E020
Description;Stop jam at the exit sensor: The trailing edge of the paper does not pass the exit sensor after its leading edge has reached this sensor.
Remedy;Open the Automatic duplexing unit. Is there any paper on the transport path? YES Remove the paper. NO Is the exit sensor working? (Perform the input check in the test mode: 03-[FAX]ON/[9]/[B]) NO 1. Check if the connector of the exit sensor is disconnected. 2. Check if the connector CN309 on the LGC board is disconnected. 3. Check if the connector pins are disconnected and the harnesses are open circuited. 4. Check if the conductor pattern on the LGC board is short circuited or open circuited. 5. Replace the exit sensor. 6. Replace the LGC board. YES Is the registration roller clutch working? (Perform the output check in the test mode: 03-108/158) NO 1. Check if the connector of the registration roller clutch is disconnected. 2. Check if the connector CN315 on the LGC board is disconnected. 3. Check if the connector pins are disconnected and the harnesses are open circuited. 4. Check if the conductor pattern on the LGC board is short circuited or open circuited. 5. Replace the registration roller clutch. 6. Replace the LGC board. YES Check the registration roller. Replace it if it is worn out.
Code;E030
Description;Power-ON jam: The paper is remaining on the paper transport path when power is turned ON.
Remedy;Open the cover of the unit/area whose picture is blinking on the control panel. Is there any paper on the transport path? (Refer to the following table.) YES Remove the paper. NO Is the sensor in the jamming area working? (Perform the input check in the test mode: refer to the following table.) NO 1. Check if the connector of the sensor is disconnected. 2. Check if any of the connectors on the LGC board is disconnected. 3. Check if the connector pins are disconnected and the harnesses are open circuited. 4. Check if the conductor pattern on the LGC board is short circuited or open circuited. 5. Replace the sensor. 6. Replace the LGC board. YES Replace the LGC board. Registration area Automatic duplexing unit Registration sensor 03-[FAX]ON/[9]/[A] 1st transport sensor 03-[FAX]OFF/[6]/[A] Exit area Automatic duplexing unit Exit sensor 03-[FAX]ON/[9]/[B] ADU ADU ADU entrance sensor 03-[FAX]OFF/[1]/[D] ADU exit sensor 03-[FAX]OFF/[1]/E] Feeding area (Main unit) Feed cover 2nd transport sensor 03-[FAX]OFF/[7]/[A] LCF LCF side cover LCF feed sensor 03-[FAX]OFF/[4]/[C] PFP PFP side cover PFP upper drawer feed sensor 03-[FAX]OFF/[2]/[B] PFP lower drawer feed sensor 03-[FAX]OFF/[3]/[B] Bridge unit Bridge unit Bridge unit transport sensor-1 03-[FAX]ON/[4]/[G] 03-[FAX]ON/[3]/[G] Bridge unit transport sensor-2 03-[FAX]ON/[4]/[F] 03-[FAX]ON/[3]/[G] JSP JSP cover JSP feed sensor 03-[FAX]ON/[3]/G] OCT OCT cover OCT feed sensor 03-[FAX]ON/[3]/[G]
Code;E061
Description;Incorrect paper size setting for upper drawer: The size of paper in the 1st drawer differs from size setting of the equipment.
Remedy;If any paper remains in the equipment or drawer, remove it. Match the paper size of the drawer setting and the one in the drawer. * Paper size detection is performed at the first sheet of paper when the drawer is opened or closed, or when the power of the equipment is turned ON.
Code;E062
Description;Incorrect paper size setting for lower drawer: The size of paper in the 2nd drawer differs from size setting of the equipment.
Remedy;If any paper remains in the equipment or drawer, remove it. Match the paper size of the drawer setting and the one in the drawer. * Paper size detection is performed at the first sheet of paper when the drawer is opened or closed, or when the power of the equipment is turned ON.
Code;E063
Description;Incorrect paper size setting for PFP upper drawer: The size of paper in the 3rd drawer differs from size setting of the equipment.
Remedy;If any paper remains in the equipment or drawer, remove it. Match the paper size of the drawer setting and the one in the drawer. * Paper size detection is performed at the first sheet of paper when the drawer is opened or closed, or when the power of the equipment is turned ON.
Code;E064
Description;Incorrect paper size setting for PFP lower drawer: The size of paper in the 4th drawer differs from size setting of the equipment.
Remedy;If any paper remains in the equipment or drawer, remove it. Match the paper size of the drawer setting and the one in the drawer. * Paper size detection is performed at the first sheet of paper when the drawer is opened or closed, or when the power of the equipment is turned ON.
Code;E065
Description;Incorrect paper size setting for bypass tray: The size of paper in the bypass tray differs from size setting of the equipment
Remedy;If any paper remains in the equipment or drawer, remove it. Match the paper size of the drawer setting and the one in the drawer. * Paper size detection is performed at the first sheet of paper when the drawer is opened or closed, or when the power of the equipment is turned ON.
Code;E090
Description;HDD abnormality causes jam: Image data to be printed cannot be prepared.
Remedy;(1) Check if the error is cleared by turning the power OFF and then back ON. (2) Check if the connectors of the HDD are disconnected. (3) Check if the connector pins are disconnected and the harnesses are open circuited. (4) Replace the HDD. (5) Replace the SYS board.
Code;E110
Description;ADU misfeeding (Paper not reaching the registration sensor): The paper which has passed through ADU does not reach the registration sensor during duplex printing
Remedy;Open the Automatic duplexing unit. Is there any paper in front of the registraton sensor? YES Remove the paper. NO Is the registraton sensor working? (Perform the input check in the test mode: 03-[FAX]ON/[9]/[A]) NO 1. Check if the connector of the 1st transport sensor is disconnected. 2. Check if the connector CN316 on the LGC board is disconnected. 3. Check if the connector pins are disconnected and the harnesses are open circuited. 4. Check if the conductor pattern on the LGC board is short circuited or open circuited. 5. Replace the 1st registration sensor. 6. Replace the LGC board. YES Is the ADU clutch working? (Perform the output check in the test mode: 03-222) NO 1. Check if the connector of the ADU clutch is disconnected. 2. Check if the connector CN304 on the LGC board is disconnected. 3. Check if the connector pins are disconnected and the harnesses are open circuited. 4. Check if the conductor pattern on the LGC board is short circuited or open circuited. 5. Replace the ADU clutch. 6. Replace the LGC board. YES Check the rollers in the ADU. Replace them if they are worn out.
Code;E120
Description;Bypass misfeeding (Paper not reaching the 1st transport sensor): The paper fed from the bypass tray does not reach the 1st transport sensor
