Code;C010
Description;Main motor abnormality: The main motor is not rotating normally.
Causes;Main motor LGC board
Remedy;"1 Is the main motor working? (Perform the output check in the test mode: 03-101/151) Yes 2 No 1. Check if the connector CN1 of the main motor is disconnected. 2. Check if the connector CN308 on the LGC board is disconnected. 3. Check if the connector pins are disconnected and the harnesses are open circuited. 4. Check if the conductor patterns on the main motor board and LGC board are short circuited or open circuited. 5. Replace the main motor. 6. Replace the LGC board. 2 Are there any damage or scratches on the main motor board? Yes 3 No 1. Check if the connector pins are disconnected and the harnesses are open circuited. 2. Check if the conductor patterns on the main motor board and LGC board are short circuited or open circuited. 3. Replace the main motor. 4. Replace the LGC board. 3 LGC board 1. Check if the PLL lock signal CN308-8 output from the LGC board is always level ""L""? 2. Check if the voltage supplied to the CPU input terminal IC22-98 is always ""L""? 3. Replace the LGC board."
Code;C040
Description;PFP motor abnormality: The PFP motor is not rotating normally.
Causes;PFP motor PFP board LGC board
Remedy;"1 Is the PFP motor working? (Perform the output check in the test mode: 03-109/ 159) Yes 2 No 1. Check if the signal line connector CN506 of the PFP motor is disconnected. 2. Check if the connector CN246 on the PFP board is disconnected. 3. Check if the connector CN241 on the PFP board is disconnected. 4. Check if the connector CN318 on the LGC board is disconnected. 5. Check if the connector pins are disconnected and the harnesses are open circuited. 6. Check if the conductor patterns on the PFP motor board, PFP board and LGC board are short circuited or open circuited. 7. Replace the PFP motor. 8. Replace the PFP board. 9. Replace the LGC board. 2 Is the LED on the PFP motor board lit without flickering? Yes 3 No 1. Check if the connector pins are disconnected and the harnesses are open circuited. 2. Check if the conductor patterns on the PFP motor board, PFP board and LGC board are short circuited or open circuited. 3. Replace the PFP motor. 4. Replace the PFP board. 5. Replace the LGC board. 3 PFP board LGC board 1. Check if the PLL lock signal CN246-7 output from the PFP board is always ""L"" level. 2. Check if the voltage supplied to the microcomputer input terminal IC5-17 is always ""L"" level. 3. Replace the PFP board. 4. Replace the LGC board."
Code;C130
Description;Upper drawer tray abnormality: The upper drawer tray motor is not rotating or the upper drawer tray is not moving normally.
Causes;LGC board Tray-up motor Tray-up sensor
Remedy;1 Does the tray go up? (Perform the output check in the test mode: 03-242/ 243) Yes 2 No 1. Check if the connector of the tray-up motor is disconnected. 2. Check if the connector CN316 on the LGC board is disconnected. 3. Check if the connector pins are disconnected and the harnesses are open circuited. 4. Check if the conductor pattern on the LGC board is short circuited or open circuited. 5. Replace the LGC board. 2 Is the tray-up sensor working? (Perform the input check in the test mode: 03- [FAX]OFF/[6]/[B], /[7]/[B]) Yes 3 No 1. Check if the connector of the sensor is disconnected. 2. Check if the connector CN315 on the LGC board is disconnected. 3. Check if the slit reaches the sensor. 4. Check if the connector pins are disconnected and the harnesses are open circuited. 5. Check if the conductor pattern on the LGC board is short circuited or open circuited. 6. Replace the LGC board. 3 LGC board 1. Check if the conductor pattern on the LGC board is short circuited or open circuited. 2. Replace the LGC board.
Code;C140
Description;Lower drawer tray abnormality: The lower drawer tray motor is not rotating or the lower drawer tray is not moving normally.
Causes;LGC board Tray-up motor Tray-up sensor
Remedy;1 Does the tray go up? (Perform the output check in the test mode: 03-242/ 243) Yes 2 No 1. Check if the connector of the tray-up motor is disconnected. 2. Check if the connector CN316 on the LGC board is disconnected. 3. Check if the connector pins are disconnected and the harnesses are open circuited. 4. Check if the conductor pattern on the LGC board is short circuited or open circuited. 5. Replace the LGC board. 2 Is the tray-up sensor working? (Perform the input check in the test mode: 03- [FAX]OFF/[6]/[B], /[7]/[B]) Yes 3 No 1. Check if the connector of the sensor is disconnected. 2. Check if the connector CN315 on the LGC board is disconnected. 3. Check if the slit reaches the sensor. 4. Check if the connector pins are disconnected and the harnesses are open circuited. 5. Check if the conductor pattern on the LGC board is short circuited or open circuited. 6. Replace the LGC board. 3 LGC board 1. Check if the conductor pattern on the LGC board is short circuited or open circuited. 2. Replace the LGC board.
Code;C150
Description;PFP upper drawer tray abnormality: The PFP upper drawer tray motor is not rotating or the PFP upper drawer tray is not moving normally.
Causes;PFP board LGC board Tray-up motor Tray-up sensor
Remedy;1 Does the tray go up? (Perform the output check in the test mode: 03-278/ 280) Yes 2 No 1. Check if the connector of the tray-up motor is disconnected. 2. Check if any of the connectors CN241 and CN244 on the PFP board is disconnected. 3. Check if the connector CN318on the LGC board is disconnected. 4. Check if the connector pins are disconnected and the harnesses are open circuited. 5. Check if the conductor patterns on the PFP board and LGC board are short circuited or open circuited. 6. Replace the PFP board. 7. Replace the LGC board. 2 Is the tray-up sensor working? (Perform the input check in the test mode: 03- [FAX]OFF/[2]/[D], /[3]/[D]) Yes 3 No 1. Check if the connector of the sensor is disconnected. 2. Check if any of the connectors CN241, CN247 and CN248 on the PFP board is disconnected. 3. Check if the connector CN318 on the LGC board is disconnected. 4. Check if the slit reaches the sensor. 5. Check if the connector pins are disconnected and the harnesses are open circuited. 6. Check if the conductor patterns on the PFP board and LGC board are short circuited or open circuited. 7. Replace the PFP board. 8. Replace the LGC board. 3 LGC board 1. Check if the conductor pattern on the LGC board is short circuited or open circuited. 2. Replace the LGC board.
Code;C160
Description;PFP lower drawer tray abnormality: The PFP lower drawer tray motor is not rotating or the PFP lower drawer tray is not moving normally
Causes;PFP board LGC board Tray-up motor Tray-up sensor
Remedy;1 Does the tray go up? (Perform the output check in the test mode: 03-278/ 280) Yes 2 No 1. Check if the connector of the tray-up motor is disconnected. 2. Check if any of the connectors CN241 and CN244 on the PFP board is disconnected. 3. Check if the connector CN318on the LGC board is disconnected. 4. Check if the connector pins are disconnected and the harnesses are open circuited. 5. Check if the conductor patterns on the PFP board and LGC board are short circuited or open circuited. 6. Replace the PFP board. 7. Replace the LGC board. 2 Is the tray-up sensor working? (Perform the input check in the test mode: 03- [FAX]OFF/[2]/[D], /[3]/[D]) Yes 3 No 1. Check if the connector of the sensor is disconnected. 2. Check if any of the connectors CN241, CN247 and CN248 on the PFP board is disconnected. 3. Check if the connector CN318 on the LGC board is disconnected. 4. Check if the slit reaches the sensor. 5. Check if the connector pins are disconnected and the harnesses are open circuited. 6. Check if the conductor patterns on the PFP board and LGC board are short circuited or open circuited. 7. Replace the PFP board. 8. Replace the LGC board. 3 LGC board 1. Check if the conductor pattern on the LGC board is short circuited or open circuited. 2. Replace the LGC board.
Code;C180
Description;LCF tray-up motor abnormality: The LCF tray-up motor is not rotating or the LCF tray is not moving normally.
Causes;LCF board LGC board LCF tray-up moto LCF tray-up sensor
Remedy;1 Does the tray move? (Perform the output check in the test mode: 03-271) Yes 2 No 1. Does the tray move? (Perform the output check in the test mode: 03-271) 2. Check if the connector of the LCF tray-up motor is disconnected. 3. Check if any of the connectors CN1 and CN5 on the LCF board is disconnected. 4. Check if the connector CN318 on the LGC board is disconnected. 5. Check if the connector pins are disconnected and the harnesses are open circuited. 6. Check if the conductor patterns on the LCF board and LGC board are short circuited or open circuited. 7. Replace the LCF board. 2 Are the LCF tray bottom sensor and LCF tray-up sensor working? (Perform the input check in the test mode: 03- [FAX]OFF/[5]/[A], /[5]/[B]) Yes 3 No 1. Check if the connectors of the sensors are disconnected. 2. Check if any of the connectors CN1, CN2 and CN6 on the LCF board is disconnected. 3. Check if the connector CN318 on the LGC board is disconnected. 4. Check if the slit reaches the sensors. 5. Check if the connector pins are disconnected and the harnesses are open circuited. 6. Check if the conductor patterns on the LCF board and LGC board are short circuited or open circuited. 7. Replace the LCF board. 8. Replace the LGC board. 3 LGC board 1. Check if the conductor pattern on the LGC board is short circuited or open circuited. 2. Replace the LGC board.
Code;C1A0
Description;LCF end fence motor abnormality: The LCF end fence motor is not rotating or the LCF end fence is not moving normally.
Causes;LCF board LGC board LCF end fence motor End fence home/stop position sensors
Remedy;1 Is the LCF end fence motor working? (Perform the output check in the test mode: 03-207) Yes 2 No 1. Check if the connector of the LCF end fence motor is disconnected. 2. Check if any of the connectors CN1 and CN5 on the LCF board is disconnected. 3. Check if the connector CN318 on the LGC board is disconnected. 4. Check if the connector pins are disconnected and the harnesses are open circuited. 5. Check if the conductor patterns on the LCF board and LGC board are short circuited or open circuited. 6. Replace the LCF board. 7. Replace the LGC board. 2 Are the LCF end fence home/stop position sensors working? (Perform the input check in the test mode: 03- [FAX]OFF/[5]/[D], /[5]/[C]) Yes 3 No 1. Check if the connectors of the sensors are disconnected. 2. Check if either of the connectors CN1 or CN4 on the LCF board is disconnected. 3. heck if the connector CN318 on the LGC board is disconnected. 4. Check if the slit reaches the sensors. 5. Check if the connector pins are disconnected and the harnesses are open circuited. 6. Check if the conductor patterns on the LCF board and LGC board are short circuited or open circuited. 7. Replace the LCF board. 8. Replace the LGC board. 3 LGC board 1. Check if the conductor pattern on the LGC board is short circuited or open circuited. 2. Replace the LGC board.
Code;C1B0
Description;LCF transport motor abnormality: The LCF transport motor is not rotating normally.
Causes;LCF transport motor LCF board LGC board
Remedy;"1 Is the LCF transport motor working? (Perform the output check in the test mode: 03-122/172) Yes 2 No 3 2 LCF transport motor LCF board LGC board 1. Check if the connector pins are disconnected and the harnesses are open circuited. 2. Check if the conductor patterns on the LCF transport motor board, LCF board and LGC board are short circuited or open circuited. 3. Check if the PLL lock signal CN3-10 output from the LCF board is always ""L"" level. 4. Check if the voltage supplied to the microcomputer input terminal IC103-17 is always ""L"" level. 5. Replace the LCF transport motor. 6. Replace the LCF board. 7. Replace the LGC board. 3 LCF transport motor LCF board LGC board 1. Check if the connector of the LCF transport motor is disconnected. 2. Check if the connector CN1, CN3 on the LCF board is disconnected. 3. Check if the connector CN318 on the LGC board is disconnected. 4. Check if the connector pins are disconnected and the harnesses are open circuited. 5. Check if the conductor patterns on the LCF transport motor board, LCF board and LGC board are short circuited or open circuited. 6. Replace the LCF transport motor. 7. Replace the LCF board. 8. Replace the LGC board."
Code;C260
Description;Scanning system related service call Peak detection error: Lighting of the exposure lamp (white reference) is not detected when power is turned ON.
Causes;Lens unit SLG board Inverter / LED board Exposure lamp
Remedy;1 Does the exposure lamp light? (Perform the output check: 03-267) Yes 2 No 3 2 CCD board SLG board 1. Check if the connectors on the CCD and SLG boards are disconnected. 2. Check if the shading correction plate is dirty. 3. Check if the conductor pattern on the CCD board is short circuited or open circuited. 4. Check if the conductor pattern on the SLG board is short circuited or open circuited. 3 Exposure lamp Inverter / LED board SLG board 1. Check if the connectors of the exposure lamp and inverter / LED board are disconnected. 2. Check the SLG board if the connector pin CN21 is disconnected or the harness is short circuited or open circuited. 3. Check if the conductor pattern on the SLG board is short circuited or open circuited.
Code;C270
Description;Scanning system related service call Carriage home position sensor not turning OFF within a specified period of time: The carriage does not shift from its home position in a specified period of time.
Causes;SLG board
Remedy;Are the carriages slightly moved to the feeding direction? Are the carriages staying at a position other than home position? Yes 1. Check if the connector of the scan motor is disconnected. 2. Check if the connector pin is disconnected and the harness is short circuited or open circuited. 3. Replace the SLG board. No 1. Check if the connector pin is disconnected and the harness is short circuited or open circuited. 2. Check if the conductor pattern on the SLG board is short circuited or open circuited. 3. Replace the SLG board.
Code;C280
Description;Scanning system related service call Carriage home position sensor not turning ON within a specified period of time: The carriage does not reach to its home position in a specified period of time.
Causes;SLG board
Remedy;Do the carriages make a big noise after they arrive at the home position? Yes The carriage home position sensor is not turned ON. 1. Check if the connector of the sensor is disconnected. 2. Replace the carriage home position sensor. 3. Replace the SLG board. No The carriages are stopped at the home position and do not move. 1. Check if the connector pins are disconnected and the harnesses are short circuited or open circuited. 2. Check if the conductor pattern on the SLG board is short circuited or open circuited. 3. Replace the SLG board.
Code;C290
Description;Scanning system related service call Scanner fuse blowout: 24V power for the scanning system is not supplied at the scanner warming-up after power-ON.
Causes;Fuse in the scanning system SLG board
Remedy;1 Switching regulator Check if any fuse in the scanning system is blown out. 2 SLG board Check if the conductor pattern on the SLG board is short circuited or open circuited. Check if the 24V output and the grounding wire are normal.
Code;C3D0
Description;Process related service call EPU board memory overwriting error: The overwriting of the EPU board memory fails.
Causes;EPU memory board LGC board
Remedy;Process unit Check if the process unit is properly installed, and check if the connector pins that are connected to the equipment are disconnected or have any abnormality such as deformation. EPU memory board Check if the harness connected to the connector J451 on the EPU board has any abnormality.
Code;C3D1
Description;Process related service call EPU board memory new parts detection error: The EPU board detects the process unit as a new unit when the equipment is started in the normal mode.
Causes;EPU memory board LGC board
Remedy;Process unit 1. If the process unit has been replaced with a new one before the equipment is started, turn the power OFF and then back ON in the EPU replacement mode ([7] + [START]). 2. If the process unit has not been replaced, check the following. 3. Check if the process unit is properly installed, and check if the connector pins that are connected to the equipment are disconnected or have any abnormality such as deformation. 4. Check if the harness connected to the connector J451 on the EPU board has any abnormality.
Code;C3D2
Description;Process related service call EPU board memory old parts detection error: The EPU board cannot detect the new process unit when the equipment is started in the EPU replacement mode ([7] + [START]).
Causes;EPU memory board LGC board
Remedy;Process unit EPU memory board 1. Check if the process unit is a new one. If it is a new one, check the following: 2. Check if the process unit is properly installed, and check if the connector pins that are connected to the equipment are disconnected or have any abnormality such as deformation. 3. Check if the harness connected to the connector J451 on the EPU board has any abnormality.
Code;C410
Description;Fuser unit related service call Thermistor or heater abnormality at power-ON: Abnormality of service call the thermistor is detected when power is turned ON or the temperature of the fuser roller does not rise in a specified period of time after power is turned ON.
Causes;LGC board
Remedy;"1. Check the thermistors 1. Check if the connectors are disconnected. 2. Check if the center, side and edge thermistors are in contact with the surface of the fuser roller properly? 3. Check if the center, side and edge thermistors are not deformed or dirty. 4. Check if the harnesses of the center, side and edge thermistors are open circuited. 2. Check the heater 1. Check if the heater is broken. 2. Check if the connector of the heater is disconnected. 3. Check if the harnesses are connected properly to the terminals of the heater lamp. 4. Check if the thermostat is blown. 3. Check the LGC board 1. Check if the connectors CN308 are disconnected. 2. Check if the conductor pattern on the LGC board is short circuited or open circuited. 3. Replace the LGC board. 4. Clear the status counter After repairing the matter which caused the error [C410], perform the following: 1. Turn ON the power while [0] and [8] are pressed simultaneously. 2. Key in ""2002"", then press [START]. 3. Change the current status counter value ""1"" or ""2"" to ""0"", then press [OK] or [INTERRUPT] (to cancel [C410]). 4. Turn the power OFF and then back ON. Make sure that the equipment enters the normal ready state."
Code;C430
Description;Fuser unit related service call Thermistor abnormality: Abnormality of the thermistor is detected after a specified period of time has passed from power-ON (including ready state).
Causes;Switching regulator
Remedy;"1. Check the thermistors 1. Check if the connectors are disconnected. 2. Check if the center, side and edge thermistors are in contact with the surface of the fuser roller properly? 3. Check if the center, side and edge thermistors are not deformed or dirty. 4. Check if the harnesses of the center, side and edge thermistors are open circuited. 2. Check the heater 1. Check if the heater is broken. 2. Check if the connector of the heater is disconnected. 3. Check if the harnesses are connected properly to the terminals of the heater lamp. 4. Check if the thermostat is blown. 3. Check the LGC board 1. Check if the connectors CN308 are disconnected. 2. Check if the conductor pattern on the LGC board is short circuited or open circuited. 3. Replace the LGC board. 4. Check the ground connection of the heat roller 1. Check if the fuser unit is tightly screwed to the equipment with no gap. Notes: • Tighten the screws while pressing the fuser unit with your hand. • Using a driver is reccomended to fix the fuser unit. 2. Check if the grounding leaf spring in the fuser unit is in contact due to deformation. Fig.8-1 5. Check the power supply Replace the switching regulator. 6. Clear the status counter • Change the current status counter value (08-2002) ""4"" to ""0"" for [C430] and ""5"", ""7"" or ""9"" to ""0"" for [C440], taking the same procedure as that for [C410]. * The status counter value is as follows in the following c ases. Change them to “0” respectively. - The error occurred during warming-up: “4” or “5” - The error occurred after the equipment has become ready: “7” - The temperature detected by the center thermistor is 240°C or higher: “9” - The temperature detected by the side thermistor is 240°C or higher: “9” - The temperature detected by the edge thermistor is 240°C or higher: “9” only during printing."
Code;C440
Description;Fuser unit related service call Fuser roller abnormality: The temperature of the fuser roller has exceeded the range of control or does not even reach the range.
Causes;Switching regulator
Remedy;"1. Check the thermistors 1. Check if the connectors are disconnected. 2. Check if the center, side and edge thermistors are in contact with the surface of the fuser roller properly? 3. Check if the center, side and edge thermistors are not deformed or dirty. 4. Check if the harnesses of the center, side and edge thermistors are open circuited. 2. Check the heater 1. Check if the heater is broken. 2. Check if the connector of the heater is disconnected. 3. Check if the harnesses are connected properly to the terminals of the heater lamp. 4. Check if the thermostat is blown. 3. Check the LGC board 1. Check if the connectors CN308 are disconnected. 2. Check if the conductor pattern on the LGC board is short circuited or open circuited. 3. Replace the LGC board. 4. Check the ground connection of the heat roller 1. Check if the fuser unit is tightly screwed to the equipment with no gap. Notes: • Tighten the screws while pressing the fuser unit with your hand. • Using a driver is reccomended to fix the fuser unit. 2. Check if the grounding leaf spring in the fuser unit is in contact due to deformation. Fig.8-1 5. Check the power supply Replace the switching regulator. 6. Clear the status counter • Change the current status counter value (08-2002) ""4"" to ""0"" for [C430] and ""5"", ""7"" or ""9"" to ""0"" for [C440], taking the same procedure as that for [C410]. * The status counter value is as follows in the following c ases. Change them to “0” respectively. - The error occurred during warming-up: “4” or “5” - The error occurred after the equipment has become ready: “7” - The temperature detected by the center thermistor is 240°C or higher: “9” - The temperature detected by the side thermistor is 240°C or higher: “9” - The temperature detected by the edge thermistor is 240°C or higher: “9” only during printing."
Code;C450
Description;Fuser unit related service call Thermistor abnormality during printing: Abnormality of the thermistor is detected during printing.
Causes;LGC board
Remedy;"1. Check the edge thermistor 1. Check if the connector is disconnected. 2. Check if the edge thermistor is in contact with the surface of the fuser roller properly. 3. Check if the harness of the edge thermistor is open circuited. 2. Check the LGC board 1. Check if the connector CN308 is disconnected. 2. Check if the conductor pattern on the board is short circuited or open circuited. 3. Replace the LGC board. 3. Clear the status counter 1. Change the current status counter value (08-2002) ""6"" to ""0""."
Code;C4C0
Description;Fuser unit related service call Fuser unit new/old detection fuse abnormality
Causes;Fuser unit. PC board
Remedy;1. Check the fuser unit. 1. Are the connectors disconnected? 2. Are the harnesses open circuited? 3. Replace the fuser unit. 2. Check the PC board 1. Are the connectors disconnected? 2. Are the harnesses short circuited or open circuited? 3. Replace the board.
Code;C550
Description;RADF I/F error: Communication error has occurred between the RADF and the scanner.
Causes;RADF board SLG board
Remedy;RADF board • Check if the harness connecting the RADF board and SLG board is disconnected or open circuited. • Check if the conductor pattern on the RADF board is short circuited or open circuited. SLG board Check if the conductor pattern on the SLG board is short circuited or open circuited.
Code;C551
Description;Document feeder model detection error: An optional document feeder that is not compatible to this equipment is installed.
Causes;
Remedy;RADF Check if the installed RADF is an option exclusively set for the model. Replace the RADF with the one exclusively set for the model.
Code;C570
Description;Communication error between Engine-CPU and CNV board
Causes;LGC board CNV board
Remedy;LGC board • Check if the LGC board and CNV board are connected properly. • Check if the conductor pattern on the LGC board is short circuited or open circuited. CNV board Check if the conductor pattern on the CNV board is short circuited or open circuited.
Code;C580
Description;Communication error between CNV board and finisher
Causes;CNV board Finisher controller PC board
Remedy;Setting of the equipment • Check if the MJ-1101, MJ-1106, MJ-1032 or MJ-1033 is set as the specified finisher on the equipment (08-4548). CNV board • Check if the harness connecting the CNV board and the finisher controller PC board is disconnected or open circuited. • Check if the conductor pattern on the CNV board is short circuited or open circuited. Finisher controller PC board Check if the conductor pattern on the finisher controller PC board is short circuited or open circuited.
Code;C5A0
Description;EEPROM communication abnormality (LGC board)
